,title,author,task 1,task 2,task 3,github,stars
1,Context R-CNN: Long Term Temporal Context for Per-Camera Object Detection,Sara Beery,object-detection,video-understanding,,https://github.com/tensorflow/models/tree/master/research/object_detection,64576
2,MnasFPN: Learning Latency-Aware Pyramid Architecture for Object Detection on Mobile Devices,Bo Chen,object-detection,,,https://github.com/tensorflow/models/tree/master/research/object_detection,64576
3,Google Landmarks Dataset v2 - A Large-Scale Benchmark for Instance-Level Recognition and Retrieval,Tobias Weyand,image-retrieval,transfer-learning,,https://github.com/tensorflow/models/tree/master/research/delf,64576
4,PointRend: Image Segmentation As Rendering,Alexander Kirillov,semantic-segmentation,,,https://github.com/facebookresearch/detectron2/tree/master/projects/PointRend,11147
5,Distilling Effective Supervision From Severe Label Noise,Zizhao Zhang,image-classification,,,https://github.com/google-research/google-research/tree/master/ieg,10588
6,Bridging the Gap Between Anchor-Based and Anchor-Free Detection via Adaptive Training Sample Selection,Shifeng Zhang,object-detection,,,https://github.com/open-mmlab/mmdetection,10263
7,Analyzing and Improving the Image Quality of StyleGAN,Tero Karras,image-generation,,,https://github.com/NVlabs/stylegan2,4713
8,SpineNet: Learning Scale-Permuted Backbone for Recognition and Localization,Xianzhi Du,instance-segmentation,architecture-search,object-detection,https://github.com/tensorflow/tpu/tree/master/models/official/detection,3585
9,Self-Training With Noisy Student Improves ImageNet Classification,Qizhe Xie,data-augmentation,image-classification,,https://github.com/tensorflow/tpu/tree/master/models/official/efficientnet,3582
10,EfficientDet: Scalable and Efficient Object Detection,Mingxing Tan,object-detection,object-detection-in-aerial-images,pedestrian-detection,https://github.com/zylo117/Yet-Another-EfficientDet-Pytorch,3441
11,3D Photography Using Context-Aware Layered Depth Inpainting,Meng-Li Shih,novel-view-synthesis,,,https://github.com/vt-vl-lab/3d-photo-inpainting,3339
12,SynSin: End-to-End View Synthesis From a Single Image,Olivia Wiles,,,,https://github.com/facebookresearch/pytorch3d,3255
13,Background Matting: The World Is Your Green Screen,Soumyadip Sengupta,image-matting,,,https://github.com/senguptaumd/Background-Matting,3211
14,A Multigrid Method for Efficiently Training Video Models,Chao-Yuan Wu,task-194,action-detection,action-recognition-in-videos,https://github.com/facebookresearch/SlowFast,2592
15,PULSE: Self-Supervised Photo Upsampling via Latent Space Exploration of Generative Models,Sachit Menon,face-hallucination,image-super-resolution,super-resolution,https://github.com/adamian98/pulse,2201
16,Adversarial Latent Autoencoders,Stanislav Pidhorskyi,latent-variable-models,representation-learning,style-transfer,https://github.com/podgorskiy/ALAE,2161
17,PIFuHD: Multi-Level Pixel-Aligned Implicit Function for High-Resolution 3D Human Digitization,Shunsuke Saito,3d-object-reconstruction-from-a-single-image,,,https://github.com/facebookresearch/pifuhd,2034
18,GhostNet: More Features From Cheap Operations,Kai Han,image-classification,,,https://github.com/osmr/imgclsmob,1551
19,StarGAN v2: Diverse Image Synthesis for Multiple Domains,Yunjey Choi,image-generation,image-to-image-translation,,https://github.com/clovaai/stargan-v2,1406
20,VIBE: Video Inference for Human Body Pose and Shape Estimation,Muhammed Kocabas,3d-human-pose-estimation,3d-pose-estimation,motion-capture,https://github.com/mkocabas/VIBE,1230
21,Designing Network Design Spaces,Ilija Radosavovic,image-classification,architecture-search,object-detection,https://github.com/facebookresearch/pycls,1187
22,OccuSeg: Occupancy-Aware 3D Instance Segmentation,Lei Han,3d-instance-segmentation-1,instance-segmentation,multi-task-learning,https://github.com/facebookresearch/SparseConvNet,1137
23,Momentum Contrast for Unsupervised Visual Representation Learning,Kaiming He,contrastive-learning,object-classification,self-supervised-action-recognition,https://github.com/facebookresearch/moco,1125
24,Probabilistic Regression for Visual Tracking,Martin Danelljan,visual-tracking,,,https://github.com/visionml/pytracking,1080
25,nuScenes: A Multimodal Dataset for Autonomous Driving,Holger Caesar,3d-object-detection,autonomous-driving,autonomous-vehicles,https://github.com/traveller59/second.pytorch,906
26,BlendMask: Top-Down Meets Bottom-Up for Instance Segmentation,Hao Chen,instance-segmentation,real-time-instance-segmentation,semantic-segmentation,https://github.com/aim-uofa/adet,896
27,ABCNet: Real-Time Scene Text Spotting With Adaptive Bezier-Curve Network,Yuliang Liu,scene-text,scene-text-detection,text-spotting,https://github.com/aim-uofa/AdelaiDet,896
28,Mask Encoding for Single Shot Instance Segmentation,Rufeng Zhang,instance-segmentation,semantic-segmentation,,https://github.com/aim-uofa/AdelaiDet,896
29,MaskGAN: Towards Diverse and Interactive Facial Image Manipulation,Cheng-Han Lee,,,,https://github.com/switchablenorms/CelebAMask-HQ,763
30,CoverNet: Multimodal Behavior Prediction Using Trajectory Sets,Tung Phan-Minh,trajectory-prediction,,,https://github.com/nutonomy/nuscenes-devkit,640
31,Forward and Backward Information Retention for Accurate Binary Neural Networks,Haotong Qin,neural-network-compression,quantization,,https://github.com/JDAI-CV/dabnn,623
32,Towards Accurate Scene Text Recognition With Semantic Reasoning Networks,Deli Yu,scene-text,scene-text-recognition,,https://github.com/PaddlePaddle/PaddleOCR,618
33,Deep Snake for Real-Time Instance Segmentation,Sida Peng,instance-segmentation,object-localization,real-time-instance-segmentation,https://github.com/zju3dv/snake,584
34,PolarMask: Single Shot Instance Segmentation With Polar Representation,Enze Xie,instance-segmentation,object-detection,semantic-segmentation,https://github.com/xieenze/PolarMask,583
35,GAN Compression: Efficient Architectures for Interactive Conditional GANs,Muyang Li,image-generation,architecture-search,,https://github.com/mit-han-lab/gan-compression,551
36,Interpreting the Latent Space of GANs for Semantic Face Editing,Yujun Shen,face-generation,image-generation,,https://github.com/ShenYujun/InterFaceGAN,518
37,SuperGlue: Learning Feature Matching With Graph Neural Networks,Paul-Edouard Sarlin,domain-adaptation,homography-estimation,interest-point-detection,https://github.com/magicleap/SuperGluePretrainedNetwork,506
38,Unsupervised Learning of Probably Symmetric Deformable 3D Objects From Images in the Wild,Shangzhe Wu,,,,https://github.com/elliottwu/unsup3d,504
39,Fast Sparse ConvNets,Erich Elsen,,,,https://github.com/google/XNNPACK,485
40,HigherHRNet: Scale-Aware Representation Learning for Bottom-Up Human Pose Estimation,Bowen Cheng,multi-person-pose-estimation,pose-estimation,representation-learning,https://github.com/HRNet/Higher-HRNet-Human-Pose-Estimation,482
41,Self-Supervised Learning of Pretext-Invariant Representations,Ishan Misra,object-detection,representation-learning,self-supervised-image-classification,https://github.com/HobbitLong/PyContrast,459
42,MSG-GAN: Multi-Scale Gradients for Generative Adversarial Networks,Animesh Karnewar,image-generation,,,https://github.com/akanimax/BMSG-GAN,454
43,CNN-Generated Images Are Surprisingly Easy to Spot... for Now,Sheng-Yu Wang,data-augmentation,image-generation,super-resolution,https://github.com/PeterWang512/CNNDetection,444
44,MixNMatch: Multifactor Disentanglement and Encoding for Conditional Image Generation,Yuheng Li,conditional-image-generation,image-generation,,https://github.com/Yuheng-Li/MixNMatch,424
45,RandLA-Net: Efficient Semantic Segmentation of Large-Scale Point Clouds,Qingyong Hu,3d-semantic-segmentation,semantic-segmentation,,https://github.com/QingyongHu/RandLA-Net,418
46,State-Aware Tracker for Real-Time Video Object Segmentation,Xi Chen,semantic-segmentation,semi-supervised-video-object-segmentation,video-object-segmentation,https://github.com/MegviiDetection/video_analyst,354
47,Learning to Cluster Faces via Confidence and Connectivity Estimation,Lei Yang,connectivity-estimation,face-clustering,,https://github.com/yl-1993/learn-to-cluster,349
48,Look-Into-Object: Self-Supervised Structure Modeling for Object Recognition,Mohan Zhou,fine-grained-image-classification,object-detection,object-recognition,https://github.com/JDAI-CV/DCL,337
49,DoveNet: Deep Image Harmonization via Domain Verification,Wenyan Cong,,,,https://github.com/bcmi/Image_Harmonization_Datasets,333
50,How to Train Your Deep Multi-Object Tracker,Yihong Xu,multi-object-tracking,multiple-object-tracking,multiple-people-tracking,https://github.com/yihongXU/deepMOT,326
51,Monocular Real-Time Hand Shape and Motion Capture Using Multi-Modal Data,Yuxiao Zhou,motion-capture,pose-estimation,,https://github.com/CalciferZh/minimal-hand,314
52,BBN: Bilateral-Branch Network With Cumulative Learning for Long-Tailed Visual Recognition,Boyan Zhou,representation-learning,,,https://github.com/Megvii-Nanjing/BBN,309
53,12-in-1: Multi-Task Vision and Language Representation Learning,Jiasen Lu,image-retrieval,question-answering,representation-learning,https://github.com/jiasenlu/vilbert_beta,282
54,Revisiting the Sibling Head in Object Detector,Guanglu Song,object-detection,,,https://github.com/Sense-X/TSD,274
55,"AvatarMe: Realistically Renderable 3D Facial Reconstruction ""In-the-Wild""",Alexandros Lattas,3d-face-reconstruction,face-generation,face-reconstruction,https://github.com/lattas/avatarme,271
56,Zooming Slow-Mo: Fast and Accurate One-Stage Space-Time Video Super-Resolution,Xiaoyu Xiang,super-resolution,video-frame-interpolation,video-super-resolution,https://github.com/Mukosame/Zooming-Slow-Mo-CVPR-2020,268
57,Efficient Derivative Computation for Cumulative B-Splines on Lie Groups,Christiane Sommer,calibration,,,https://github.com/VladyslavUsenko/basalt-mirror,249
58,Deep Unfolding Network for Image Super-Resolution,Kai Zhang,image-super-resolution,super-resolution,,https://github.com/cszn/USRNet,248
59,HybridPose: 6D Object Pose Estimation Under Hybrid Representations,Chen Song,6d-pose-estimation,pose-estimation,,https://github.com/chensong1995/HybridPose,242
60,Learn to Augment: Joint Data Augmentation and Network Optimization for Text Recognition,Canjie Luo,data-augmentation,image-augmentation,scene-text,https://github.com/Canjie-Luo/Scene-Text-Image-Transformer,240
61,Unbiased Scene Graph Generation From Biased Training,Kaihua Tang,graph-generation,scene-graph-generation,visual-question-answering,https://github.com/KaihuaTang/Scene-Graph-Benchmark.pytorch,239
62,Instance-Aware Image Colorization,Jheng-Wei Su,colorization,,,https://github.com/ericsujw/InstColorization,237
63,F-BRS: Rethinking Backpropagating Refinement for Interactive Segmentation,Konstantin Sofiiuk,interactive-segmentation,,,https://github.com/saic-vul/fbrs_interactive_segmentation,234
64,Densely Connected Search Space for More Flexible Neural Architecture Search,Jiemin Fang,image-classification,architecture-search,,https://github.com/JaminFong/DenseNAS,230
65,Learning Dynamic Routing for Semantic Segmentation,Yanwei Li,semantic-segmentation,,,https://github.com/yanwei-li/DynamicRouting,228
66,ECA-Net: Efficient Channel Attention for Deep Convolutional Neural Networks,Qilong Wang,dimensionality-reduction,image-classification,instance-segmentation,https://github.com/BangguWu/ECANet,228
67,Deep Image Spatial Transformation for Person Image Generation,Yurui Ren,novel-view-synthesis,,,https://github.com/RenYurui/Global-Flow-Local-Attention,222
68,DeeperForensics-1.0: A Large-Scale Dataset for Real-World Face Forgery Detection,Liming Jiang,face-swapping,,,https://github.com/EndlessSora/DeeperForensics-1.0,222
69,"Why Having 10,000 Parameters in Your Camera Model Is Better Than Twelve",Thomas Schops,calibration,depth-estimation,pose-estimation,https://github.com/puzzlepaint/camera_calibration,221
70,StegaStamp: Invisible Hyperlinks in Physical Photographs,Matthew Tancik,steganographics,,,https://github.com/tancik/StegaStamp,218
71,Structure Aware Single-Stage 3D Object Detection From Point Cloud,Chenhang He,3d-object-detection,autonomous-driving,object-detection,https://github.com/skyhehe123/SA-SSD,216
72,Scale-Equalizing Pyramid Convolution for Object Detection,Xinjiang Wang,object-detection,,,https://github.com/jshilong/SEPC,210
73,Few-Shot Object Detection With Attention-RPN and Multi-Relation Detector,Qi Fan,few-shot-object-detection,object-detection,,https://github.com/fanq15/Few-Shot-Object-Detection-Dataset,205
74,Revisiting Knowledge Distillation via Label Smoothing Regularization,Li Yuan,,,,https://github.com/yuanli2333/Teacher-free-Knowledge-Distillation,201
75,Circle Loss: A Unified Perspective of Pair Similarity Optimization,Yifan Sun,face-recognition,image-retrieval,person-re-identification,https://github.com/TinyZeaMays/CircleLoss,201
76,Learning Multiview 3D Point Cloud Registration,Zan Gojcic,point-cloud-registration,,,https://github.com/chrischoy/FCGF,195
77,Deep Global Registration,Christopher Choy,brain-segmentation,image-registration,image-super-resolution,https://github.com/chrischoy/FCGF,195
78,SEAN: Image Synthesis With Semantic Region-Adaptive Normalization,Peihao Zhu,image-generation,,,https://github.com/ZPdesu/SEAN,193
79,Semantically Multi-Modal Image Synthesis,Zhen Zhu,image-generation,,,https://github.com/Seanseattle/SMIS,191
80,CascadePSP: Toward Class-Agnostic and Very High-Resolution Segmentation via Global and Local Refinement,Ho Kei Cheng,scene-parsing,semantic-segmentation,,https://github.com/hkchengrex/CascadePSP,188
81,Distribution-Aware Coordinate Representation for Human Pose Estimation,Feng Zhang,keypoint-detection,multi-person-pose-estimation,pose-estimation,https://github.com/ilovepose/DarkPose,184
82,Neural Blind Deconvolution Using Deep Priors,Dongwei Ren,blind-image-deblurring,deblurring,image-deconvolution,https://github.com/csdwren/SelfDeblur,181
83,Closed-Loop Matters: Dual Regression Networks for Single Image Super-Resolution,Yong Guo,image-super-resolution,super-resolution,,https://github.com/guoyongcs/DRN,177
84,Learning Individual Speaking Styles for Accurate Lip to Speech Synthesis,K R Prajwal,lip-reading,lip-to-speech-synthesis,speaker-specific-lip-to-speech-synthesis,https://github.com/Rudrabha/Lip2Wav,175
85,Memory Enhanced Global-Local Aggregation for Video Object Detection,Yihong Chen,video-recognition,region-proposal,video-object-detection,https://github.com/Scalsol/mega.pytorch,172
86,Searching Central Difference Convolutional Networks for Face Anti-Spoofing,Zitong Yu,face-anti-spoofing,face-recognition,architecture-search,https://github.com/ZitongYu/CDCN,171
87,CentripetalNet: Pursuing High-Quality Keypoint Pairs for Object Detection,Zhiwei Dong,instance-segmentation,object-detection,semantic-segmentation,https://github.com/KiveeDong/CentripetalNet,170
88,Structure-Preserving Super Resolution With Gradient Guidance,Cheng Ma,image-super-resolution,super-resolution,,https://github.com/Maclory/SPSR,164
89,CurricularFace: Adaptive Curriculum Learning Loss for Deep Face Recognition,Yuge Huang,face-recognition,,,https://github.com/HuangYG123/CurricularFace,162
90,Self-Supervised Viewpoint Learning From Image Collections,Siva Karthik Mustikovela,metric-learning,self-supervised-learning,,https://github.com/NVlabs/SSV,161
91,Single-Stage Semantic Segmentation From Image Labels,Nikita Araslanov,semantic-segmentation,,,https://github.com/visinf/1-stage-wseg,160
92,Learning to Shadow Hand-Drawn Sketches,Qingyuan Zheng,,,,https://github.com/qyzdao/ShadeSketch,159
93,Rethinking Data Augmentation for Image Super-resolution: A Comprehensive Analysis and a New Strategy,Jaejun Yoo,data-augmentation,denoising,image-restoration,https://github.com/clovaai/cutblur,157
94,Towards Discriminability and Diversity: Batch Nuclear-Norm Maximization Under Label Insufficient Situations,Shuhao Cui,domain-adaptation,,,https://github.com/cuishuhao/BNM,155
95,Point-GNN: Graph Neural Network for 3D Object Detection in a Point Cloud,Weijing Shi,3d-object-detection,object-detection,,https://github.com/WeijingShi/Point-GNN,153
96,"Detection in Crowded Scenes: One Proposal, Multiple Predictions",Xuangeng Chu,object-detection,,,https://github.com/Purkialo/CrowdDet,153
97,Hyperbolic Image Embeddings,Valentin Khrulkov,zero-shot-learning,image-classification,image-retrieval,https://github.com/KhrulkovV/hyperbolic-image-embeddings,153
98,Epipolar Transformers,Yihui He,calibration,edge-detection,pose-estimation,https://github.com/yihui-he/epipolar-transformers,152
99,PV-RCNN: Point-Voxel Feature Set Abstraction for 3D Object Detection,Shaoshuai Shi,3d-object-detection,object-detection,,https://github.com/jhultman/PV-RCNN,151
100,"Panoptic-DeepLab: A Simple, Strong, and Fast Baseline for Bottom-Up Panoptic Segmentation",Bowen Cheng,instance-segmentation,panoptic-segmentation,semantic-segmentation,https://github.com/bowenc0221/panoptic-deeplab,145
101,Learning in the Frequency Domain,Kai Xu,multiple-instance-learning,time-series,time-series-classification,https://github.com/calmevtime1990/supp,144
102,PVN3D: A Deep Point-Wise 3D Keypoints Voting Network for 6DoF Pose Estimation,Yisheng He,6d-pose-estimation-1,keypoint-detection,pose-estimation,https://github.com/ethnhe/PVN3D,142
103,Disentangled and Controllable Face Image Generation via 3D Imitative-Contrastive Learning,Yu Deng,contrastive-learning,image-generation,,https://github.com/microsoft/DisentangledFaceGAN,141
104,Strip Pooling: Rethinking Spatial Pooling for Scene Parsing,Qibin Hou,scene-parsing,,,https://github.com/Andrew-Qibin/SPNet,140
105,MaskFlownet: Asymmetric Feature Matching With Learnable Occlusion Mask,Shengyu Zhao,optical-flow-estimation,,,https://github.com/microsoft/MaskFlownet,139
106,PSGAN: Pose and Expression Robust Spatial-Aware GAN for Customizable Makeup Transfer,Wentao Jiang,,,,https://github.com/wtjiang98/PSGAN,137
107,BlendedMVS: A Large-Scale Dataset for Generalized Multi-View Stereo Networks,Yao Yao,3d-reconstruction,,,https://github.com/YoYo000/BlendedMVS,137
108,Dreaming to Distill: Data-Free Knowledge Transfer via DeepInversion,Hongxu Yin,continual-learning,network-pruning,transfer-learning,https://github.com/NVlabs/DeepInversion,136
109,Evaluating Weakly Supervised Object Localization Methods Right,Junsuk Choe,few-shot-learning,model-selection,object-localization,https://github.com/clovaai/wsolevaluation,135
110,NAS-FCOS: Fast Neural Architecture Search for Object Detection,Ning Wang,architecture-search,object-detection,,https://github.com/Lausannen/NAS-FCOS,135
111,TDAN: Temporally-Deformable Alignment Network for Video Super-Resolution,Yapeng Tian,deblurring,super-resolution,video-super-resolution,https://github.com/YapengTian/TDAN-VSR,134
112,DSGN: Deep Stereo Geometry Network for 3D Object Detection,Yilun Chen,3d-object-detection,object-detection,,https://github.com/chenyilun95/DSGN,128
113,FSS-1000: A 1000-Class Dataset for Few-Shot Segmentation,Xiang Li,few-shot-image-segmentation,semantic-segmentation,,https://github.com/HKUSTCV/FSS-1000,128
114,MAST: A Memory-Augmented Self-Supervised Tracker,Zihang Lai,semantic-segmentation,semi-supervised-video-object-segmentation,video-object-segmentation,https://github.com/zlai0/MAST,127
115,Task Agnostic Robust Learning on Corrupt Outputs by Correlation-Guided Mixture Density Networks,Sungjoon Choi,autonomous-driving,,,https://github.com/sjchoi86/choicenet,123
116,3D Packing for Self-Supervised Monocular Depth Estimation,Vitor Guizilini,depth-estimation,monocular-depth-estimation,self-driving-cars,https://github.com/TRI-ML/DDAD,122
117,Softmax Splatting for Video Frame Interpolation,Simon Niklaus,depth-estimation,optical-flow-estimation,video-frame-interpolation,https://github.com/sniklaus/softmax-splatting,121
118,Rethinking Performance Estimation in Neural Architecture Search,Xiawu Zheng,architecture-search,,,https://github.com/zhengxiawu/rethinking_performance_estimation_in_NAS,115
119,Footprints and Free Space From a Single Color Image,Jamie Watson,semantic-segmentation,,,https://github.com/nianticlabs/footprints,113
120,Learning Depth-Guided Convolutions for Monocular 3D Object Detection,Mingyu Ding,3d-object-detection,monocular-3d-object-detection,object-detection,https://github.com/dingmyu/D4LCN,113
121,Meshed-Memory Transformer for Image Captioning,Marcella Cornia,image-captioning,machine-translation,text-generation,https://github.com/aimagelab/meshed-memory-transformer,111
122,Social-STGCNN: A Social Spatio-Temporal Graph Convolutional Neural Network for Human Trajectory Prediction,Abduallah Mohamed,autonomous-vehicles,trajectory-prediction,,https://github.com/abduallahmohamed/Social-STGCNN,111
123,Self-Supervised Equivariant Attention Mechanism for Weakly Supervised Semantic Segmentation,Yude Wang,data-augmentation,semantic-segmentation,weakly-supervised-semantic-segmentation,https://github.com/YudeWang/SEAM,109
124,FaceScape: A Large-Scale High Quality 3D Face Dataset and Detailed Riggable 3D Face Prediction,Haotian Yang,,,,https://github.com/zhuhao-nju/facescape,107
125,UnrealText: Synthesizing Realistic Scene Text Images From the Unreal World,Shangbang Long,image-generation,scene-text,scene-text-detection,https://github.com/Jyouhou/UnrealText,103
126,Equalization Loss for Long-Tailed Object Recognition,Jingru Tan,object-detection,object-recognition,,https://github.com/tztztztztz/eql.detectron2,102
127,FastDVDnet: Towards Real-Time Deep Video Denoising Without Flow Estimation,Matias Tassano,denoising,motion-compensation,motion-estimation,https://github.com/m-tassano/fastdvdnet,102
128,Suppressing Uncertainties for Large-Scale Facial Expression Recognition,Kai Wang,facial-expression-recognition,,,https://github.com/kaiwang960112/Self-Cure-Network,101
129,SampleNet: Differentiable Point Cloud Sampling,Itai Lang,point-cloud-registration,,,https://github.com/orendv/learning_to_sample,100
130,CycleISP: Real Image Restoration via Improved Data Synthesis,Syed Waqas Zamir,denoising,image-denoising,image-restoration,https://github.com/swz30/CycleISP,98
131,Disentangling and Unifying Graph Convolutions for Skeleton-Based Action Recognition,Ziyu Liu,stochastic-optimization,,,https://github.com/kenziyuliu/ms-g3d,98
132,AANet: Adaptive Aggregation Network for Efficient Stereo Matching,Haofei Xu,stereo-matching-1,,,https://github.com/haofeixu/aanet,98
133,Coherent Reconstruction of Multiple Humans From a Single Image,Wen Jiang,3d-pose-estimation,3d-reconstruction,instance-segmentation,https://github.com/JiangWenPL/multiperson,98
134,Celeb-DF: A Large-Scale Challenging Dataset for DeepFake Forensics,Yuezun Li,deepfake-detection,face-swapping,,https://github.com/danmohaha/celeb-deepfakeforensics,96
135,Image Super-Resolution With Cross-Scale Non-Local Attention and Exhaustive Self-Exemplars Mining,Yiqun Mei,image-super-resolution,super-resolution,,https://github.com/SHI-Labs/Cross-Scale-Non-Local-Attention,96
136,SGAS: Sequential Greedy Architecture Search,Guohao Li,image-classification,architecture-search,node-classification,https://github.com/lightaime/sgas,94
137,Filter Response Normalization Layer: Eliminating Batch Dependence in the Training of Deep Neural Networks,Saurabh Singh,image-classification,object-detection,,https://github.com/gupta-abhay/pytorch-frn,94
138,Deep Face Super-Resolution With Iterative Collaboration Between Attentive Recovery and Landmark Estimation,Cheng Ma,super-resolution,,,https://github.com/Maclory/Deep-Iterative-Collaboration,94
139,PointGroup: Dual-Set Point Grouping for 3D Instance Segmentation,Li Jiang,3d-instance-segmentation-1,instance-segmentation,scene-understanding,https://github.com/Jia-Research-Lab/PointGroup,94
140,Cascade Cost Volume for High-Resolution Multi-View Stereo and Stereo Matching,Xiaodong Gu,stereo-matching-1,,,https://github.com/alibaba/cascade-stereo,93
141,Deep Relational Reasoning Graph Network for Arbitrary Shape Text Detection,Shi-Xue Zhang,graph-construction,relational-reasoning,,https://github.com/GXYM/DRRG,93
142,Contextual Residual Aggregation for Ultra High-Resolution Image Inpainting,Zili Yi,image-inpainting,,,https://github.com/Atlas200dk/sample-imageinpainting-HiFill,92
143,Adversarial Texture Optimization From RGB-D Scans,Jingwei Huang,texture-synthesis,,,https://github.com/hjwdzh/AdversarialTexture,91
144,Super-BPD: Super Boundary-to-Pixel Direction for Fast Image Segmentation,Jianqiang Wan,semantic-segmentation,,,https://github.com/JianqiangWan/Super-BPD,91
145,Violin: A Large-Scale Dataset for Video-and-Language Inference,Jingzhou Liu,,,,https://github.com/jimmy646/violin,90
146,End-to-End Learnable Geometric Vision by Backpropagating PnP Optimization,Bo Chen,6d-pose-estimation-1,6d-pose-estimation,,https://github.com/BoChenYS/BPnP,90
147,CARS: Continuous Evolution for Efficient Neural Architecture Search,Zhaohui Yang,architecture-search,,,https://github.com/huawei-noah/CARS,89
148,Deep Spatial Gradient and Temporal Depth Learning for Face Anti-Spoofing,Zezheng Wang,face-anti-spoofing,face-recognition,,https://github.com/clks-wzz/FAS-SGTD,88
149,PolarNet: An Improved Grid Representation for Online LiDAR Point Clouds Semantic Segmentation,Yang Zhang,3d-semantic-segmentation,autonomous-driving,semantic-segmentation,https://github.com/edwardzhou130/PolarSeg,86
150,Block-Wisely Supervised Neural Architecture Search With Knowledge Distillation,Changlin Li,architecture-search,,,https://github.com/changlin31/DNA,85
151,X-Linear Attention Networks for Image Captioning,Yingwei Pan,fine-grained-visual-recognition,image-captioning,question-answering,https://github.com/Panda-Peter/image-captioning,84
152,ASLFeat: Learning Local Features of Accurate Shape and Localization,Zixin Luo,face-recognition,image-retrieval,person-re-identification,https://github.com/lzx551402/ASLFeat,83
