,title,author,task 1,task 2,task 3,github,stars
468,Generalized Product Quantization Network for Semi-Supervised Image Retrieval,Young Kyun Jang,image-retrieval,metric-learning,quantization,https://github.com/youngkyunJang/GPQ,7
469,GeoDA: A Geometric Framework for Black-Box Adversarial Attacks,Ali Rahmati,,,,https://github.com/thisisalirah/GeoDA,7
470,Two Causal Principles for Improving Visual Dialog,Jiaxin Qi,visual-dialogue,,,https://github.com/simpleshinobu/visdial-principles,7
471,Multi-Modal Graph Neural Network for Joint Reasoning on Vision and Scene Text,Difei Gao,question-answering,scene-text,visual-question-answering,https://github.com/ricolike/mmgnn_textvqa,7
472,Universal Physical Camouflage Attacks on Object Detectors,Lifeng Huang,region-proposal,,,https://github.com/mesunhlf/UPC-tf,7
473,MMTM: Multimodal Transfer Module for CNN Fusion,Hamid Reza Vaezi Joze,action-recognition-in-videos,gesture-recognition,hand-gesture-recognition,https://github.com/haamoon/mmtm,7
474,Network Adjustment: Channel Search Guided by FLOPs Utilization Ratio,Zhengsu Chen,image-classification,network-pruning,,https://github.com/danczs/NetworkAdjustment,7
475,A Characteristic Function Approach to Deep Implicit Generative Modeling,Abdul Fatir Ansari,image-generation,,,https://github.com/crslab/OCFGAN,7
476,What It Thinks Is Important Is Important: Robustness Transfers Through Input Gradients,Alvin Chan,,,,https://github.com/alvinchangw/IGAM_CVPR2020,7
477,Mixture Dense Regression for Object Detection and Human Pose Estimation,Ali Varamesh,dense-object-detection,object-detection,pose-estimation,https://github.com/alivaramesh/MixtureDenseRegression,7
478,Breaking the Cycle - Colleagues Are All You Need,Ori Nizan,image-to-image-translation,multimodal-unsupervised-image-to-image,unsupervised-image-to-image-translation,https://github.com/Onr/Council-GAN,7
479,Seeing without Looking: Contextual Rescoring of Object Detections for AP Maximization,Lourenco V. Pato,object-detection,,,https://github.com/LourencoVazPato/seeing-without-looking,7
480,Uncertainty-Aware Score Distribution Learning for Action Quality Assessment,Yansong Tang,,,,https://github.com/nzl-thu/MUSDL,6
481,Distilling Cross-Task Knowledge via Relationship Matching,Han-Jia Ye,,,,https://github.com/njulus/ReFilled,6
482,Uncertainty Based Camera Model Selection,Michal Polic,autonomous-driving,calibration,,https://github.com/michalpolic/unc_model_selection,6
483,Effectively Unbiased FID and Inception Score and Where to Find Them,Min Jin Chong,,,,https://github.com/mchong6/FID_IS_infinity,6
484,Unsupervised Model Personalization While Preserving Privacy and Scalability: An Open Problem,Matthias De Lange,continual-learning,domain-adaptation,scene-recognition,https://github.com/mattdl/DUA,6
485,Butterfly Transform: An Efficient FFT Based Neural Architecture Design,Keivan Alizadeh vahid,architecture-search,,,https://github.com/keivanalizadeh/ButterflyTransform,6
486,Convolution in the Cloud: Learning Deformable Kernels in 3D Graph Convolution Networks for Point Cloud Analysis,Zhi-Hao Lin,,,,https://github.com/j1a0m0e4sNTU/3dgcn,6
487,An Investigation Into the Stochasticity of Batch Whitening,Lei Huang,,,,https://github.com/huangleiBuaa/StochasticityBW,6
488,On Positive-Unlabeled Classification in GAN,Tianyu Guo,self-supervised-learning,,,https://github.com/huangjiadidi/PUGAN,6
489,Probability Weighted Compact Feature for Domain Adaptive Retrieval,Fuxiang Huang,image-retrieval,quantization,,https://github.com/fuxianghuang1/PWCF,6
490,Differentiable Adaptive Computation Time for Visual Reasoning,Cristobal Eyzaguirre,visual-reasoning,,,https://github.com/ceyzaguirre4/DACT-MAC,6
491,Universal Litmus Patterns: Revealing Backdoor Attacks in CNNs,Soheil Kolouri,traffic-sign-recognition,,,https://github.com/UMBCvision/Universal-Litmus-Patterns,6
492,Enhancing Intrinsic Adversarial Robustness via Feature Pyramid Decoder,Guanlin Li,denoising,image-restoration,self-supervised-learning,https://github.com/GuanlinLee/FPD-for-Adversarial-Robustness,6
493,An Efficient PointLSTM for Point Clouds Based Gesture Recognition,Yuecong Min,gesture-recognition,,,https://github.com/Blueprintf/pointlstm-gesture-recognition-pytorch,6
494,JA-POLS: A Moving-Camera Background Model via Joint Alignment and Partially-Overlapping Local Subspaces,Irit Chelly,,,,https://github.com/BGU-CS-VIL/JA-POLS,6
495,Conv-MPN: Convolutional Message Passing Neural Network for Structured Outdoor Architecture Reconstruction,Fuyang Zhang,,,,https://github.com/zhangfuyang/Conv-MPN,5
496,Old Is Gold: Redefining the Adversarially Learned One-Class Classifier Training Paradigm,Muhammad Zaigham Zaheer,anomaly-detection,one-class-classifier,,https://github.com/xaggi/OGNet,5
497,Iterative Context-Aware Graph Inference for Visual Dialog,Dan Guo,graph-embedding,visual-dialogue,,https://github.com/wh0330/CAG_VisDial,5
498,View-GCN: View-Based Graph Convolutional Network for 3D Shape Analysis,Xin Wei,3d-shape-analysis,3d-shape-retrieval,3d-shape-recognition,https://github.com/weixmath/view-GCN,5
499,Semantic Pyramid for Image Generation,Assaf Shocher,object-detection,semantic-segmentation,semantic-segmentation,https://github.com/rosinality/semantic-pyramid-pytorch,5
500,Leveraging 2D Data to Learn Textured 3D Mesh Generation,Paul Henderson,,,,https://github.com/pmh47/textured-mesh-gen,5
501,Perceptual Quality Assessment of Smartphone Photography,Yuming Fang,blind-image-quality-assessment,image-quality-assessment,,https://github.com/h4nwei/SPAQ,5
502,Learning Better Lossless Compression Using Lossy Compression,Fabian Mentzer,image-compression,,,https://github.com/fab-jul/RC-PyTorch,5
503,Exploit Clues From Views: Self-Supervised and Regularized Learning for Multiview Object Recognition,Chih-Hui Ho,object-recognition,self-supervised-learning,,https://github.com/chihhuiho/VISPE,5
504,Shape Reconstruction by Learning Differentiable Surface Representations,Jan Bednarik,,,,https://github.com/bednarikjan/differential_surface_representation,5
505,Belief Propagation Reloaded: Learning BP-Layers for Labeling Problems,Patrick Knobelreiter,optical-flow-estimation,semantic-segmentation,,https://github.com/VLOGroup/bp-layers,5
506,Rotation Equivariant Graph Convolutional Network for Spherical Image Classification,Qin Yang,graph-construction,image-classification,,https://github.com/QinYang12/SGCN,5
507,A Self-supervised Approach for Adversarial Robustness,Muzammal Naseer,semantic-segmentation,semi-supervised-semantic-segmentation,out-of-distribution-detection,https://github.com/Muzammal-Naseer/NRP,5
508,Discriminative Multi-Modality Speech Recognition,Bo Xu,lipreading,speech-recognition,,https://github.com/JackSyu/Discriminative-Multi-modality-Speech-Recognition,5
509,McFlow: Monte Carlo Flow Models for Data Imputation,Trevor W. Richardson,imputation,,,https://github.com/trevor-richardson/MCFlow,4
510,Noise Robust Generative Adversarial Networks,Takuhiro Kaneko,robust-speech-recognition,speech-dereverberation,speech-enhancement,https://github.com/takuhirok/NR-GAN,4
511,ColorFool: Semantic Adversarial Colorization,Ali Shahin Shamsabadi,adversarial-attack,colorization,denoising,https://github.com/smartcameras/ColorFool,4
512,Unsupervised Person Re-Identification via Softened Similarity Learning,Yutian Lin,person-re-identification,quantization,unsupervised-person-re-identification,https://github.com/ryanaleksander/softened-similarity-learning,4
513,Learning Selective Self-Mutual Attention for RGB-D Saliency Detection,Nian Liu,saliency-detection,,,https://github.com/nnizhang/S2MA,4
514,Visual Chirality,Zhiqiu Lin,data-augmentation,image-forensics,self-supervised-learning,https://github.com/linzhiqiu/digital_chirality,4
515,Adaptive Interaction Modeling via Graph Operations Search,Haoxin Li,,,,https://github.com/lihaoxin05/graph-operations-search,4
516,Defending and Harnessing the Bit-Flip Based Adversarial Weight Attack,Zhezhi He,adversarial-attack,,,https://github.com/elliothe/BFA,4
517,SOS: Selective Objective Switch for Rapid Immunofluorescence Whole Slide Image Classification,Sam Maksoud,image-classification,,,https://github.com/cradleai/LKS-Dataset,4
518,Generalizing Hand Segmentation in Egocentric Videos With Uncertainty-Guided Model Adaptation,Minjie Cai,hand-segmentation,,,https://github.com/cai-mj/UMA,4
519,Spherical Space Domain Adaptation With Robust Pseudo-Label Loss,Xiang Gu,domain-adaptation,,,https://github.com/XJTU-XGU/RSDA,4
520,Inferring Attention Shift Ranks of Objects for Image Saliency,Avishek Siris,,,,https://github.com/SirisAvishek/Attention_Shift_Ranks,4
521,L2-GCN: Layer-Wise and Learned Efficient Training of Graph Convolutional Networks,Yuning You,,,,https://github.com/Shen-Lab/L2-GCN,4
522,Exploring Spatial-Temporal Multi-Frequency Analysis for High-Fidelity and Temporal-Consistency Video Prediction,Beibei Jin,video-prediction,,,https://github.com/Bei-Jin/STMFANet,4
523,Learn2Perturb: An End-to-End Feature Perturbation Learning to Improve Adversarial Robustness,Ahmadreza Jeddi,adversarial-defense,,,https://github.com/Ahmadreza-Jeddi/Learn2Perturb,4
524,Light-weight Calibrator: A Separable Component for Unsupervised Domain Adaptation,Shaokai Ye,adversarial-attack,domain-adaptation,semantic-segmentation,https://github.com/yeshaokai/Calibrator-Domain-Adaptation,3
525,Few-Shot Class-Incremental Learning,Xiaoyu Tao,few-shot-learning,few-shot-image-segmentation,semantic-segmentation,https://github.com/xyutao/fscil,3
526,Fast MSER,Hailiang Xu,,,,https://github.com/mmmn143/fast-mser,3
527,Sketchformer: Transformer-Based Representation for Sketched Structure,Leo Sampaio Ferraz Ribeiro,dictionary-learning,image-retrieval,sketch-based-image-retrieval,https://github.com/leosampaio/sketchformer,3
528,"Same Features, Different Day: Weakly Supervised Feature Learning for Seasonal Invariance",Jaime Spencer,image-retrieval,,,https://github.com/jspenmar/DejaVu_Features,3
529,DeFeat-Net: General Monocular Depth via Simultaneous Unsupervised Representation Learning,Jaime Spencer,depth-estimation,monocular-depth-estimation,representation-learning,https://github.com/jspenmar/DeFeat-Net,3
530,Maintaining Discrimination and Fairness in Class Incremental Learning,Bowen Zhao,,,,https://github.com/hugoycj/Incremental-Learning-with-Weight-Aligning,3
531,Learning to Super Resolve Intensity Images From Events,S. Mohammad Mostafavi I.,image-reconstruction,super-resolution,,https://github.com/gistvision/e2sri,3
532,Deep Shutter Unrolling Network,Peidong Liu,motion-estimation,,,https://github.com/ethliup/DeepUnrollNet,3
533,Enhancing Cross-Task Black-Box Transferability of Adversarial Examples With Dispersion Reduction,Yantao Lu,adversarial-attack,image-classification,object-detection,https://github.com/erbloo/dr,3
534,Toward a Universal Model for Shape From Texture,Dor Verbin,shape-from-texture,texture-synthesis,,https://github.com/dorverbin/shapefromtexture,3
535,Reinforced Feature Points: Optimizing Feature Detection and Description for a High-Level Task,Aritra Bhowmik,pose-estimation,,,https://github.com/aritra0593/Reinforced-Feature-Points,3
536,Unsupervised Deep Shape Descriptor With Point Distribution Learning,Yi Shi,3d-shape-retrieval,,,https://github.com/WordBearerYI/Unsupervised-Deep-Shape-Descriptor-with-Point-Distribution-Learning/blob/master/README.md,3
537,Visual Reaction: Learning to Play Catch With Your Drone,Kuo-Hao Zeng,,,,https://github.com/KuoHaoZeng/Visual_Reaction,3
538,Learning the Redundancy-Free Features for Generalized Zero-Shot Object Recognition,Zongyan Han,object-recognition,zero-shot-learning,,https://github.com/Hanzy1996/RRF-GZSL,3
539,Learning to Manipulate Individual Objects in an Image,Yanchao Yang,image-manipulation-detection,object-detection,,https://github.com/ChenYutongTHU/Learning-to-manipulate-individual-objects-in-an-image-Implementation,3
540,A U-Net Based Discriminator for Generative Adversarial Networks,Edgar Schonfeld,compressive-sensing,semantic-segmentation,,https://github.com/xingchenzhao/deep-learning-team-project,2
541,SmallBigNet: Integrating Core and Contextual Views for Video Classification,Xianhang Li,video-classification,,,https://github.com/xhl-video/SmallBigNet,2
542,Towards Achieving Adversarial Robustness by Enforcing Feature Consistency Across Bit Planes,Sravanti Addepalli,,,,https://github.com/val-iisc/BPFC,2
543,SketchyCOCO: Image Generation From Freehand Scene Sketches,Chengying Gao,image-generation,,,https://github.com/sysu-imsl/EdgeGAN,2
544,TEA: Temporal Excitation and Aggregation for Action Recognition,Yan Li,action-recognition-in-videos,,,https://github.com/saijunhu/fancy-video-classification,2
545,Learning Geocentric Object Pose in Oblique Monocular Images,Gordon Christie,object-detection,optical-flow-estimation,semantic-segmentation,https://github.com/pubgeo/monocular-geocentric-pose,2
546,Deep Iterative Surface Normal Estimation,Jan Eric Lenssen,,,,https://github.com/nnaisense/pytorch_sym3eig,2
547,Camera Trace Erasing,Chang Chen,,,,https://github.com/ngchc/CameraTE,2
548,ReSprop: Reuse Sparsified Backpropagation,Negar Goli,,,,https://github.com/negargoli/ReSprop,2
549,Multimodal Future Localization and Emergence Prediction for Objects in Egocentric View With a Reachability Prior,Osama Makansi,,,,https://github.com/lmb-freiburg/FLN-EPN-RPN,2
550,Towards Visually Explaining Variational Autoencoders,Wenqian Liu,,,,https://github.com/liuem607/expVAE,2
551,NeuralScale: Efficient Scaling of Neurons for Resource-Constrained Deep Neural Networks,Eugene Lee,,,,https://github.com/eugenelet/NeuralScale,2
552,Barycenters of Natural Images  Constrained Wasserstein Barycenters for Image Morphing,Dror Simon,image-morphing,,,https://github.com/drorsimon/image_barycenters,2
553,Fast Symmetric Diffeomorphic Image Registration with Convolutional Neural Networks,Tony C.W. Mok,image-registration,,,https://github.com/cwmok/Fast-Symmetric-Diffeomorphic-Image-Registration-with-Convolutional-Neural-Networks,2
554,Dynamic Neural Relational Inference,Colin Graber,monocular-visual-odometry,motion-estimation,visual-odometry,https://github.com/cgraber/cvpr_dNRI,2
555,Quaternion Product Units for Deep Learning on 3D Rotation Groups,Xuan Zhang,,,,https://github.com/IICNELAB/qpu_code,2
556,Zero-Assignment Constraint for Graph Matching With Outliers,Fudong Wang,graph-matching,,,https://github.com/wangfudong/ZAC_GM,1
557,Defending Against Universal Attacks Through Selective Feature Regeneration,Tejas Borkar,adversarial-defense,,,https://github.com/tsborkar/Selective-feature-regeneration,1
558,Attention-Based Context Aware Reasoning for Situation Recognition,Thilini Cooray,question-answering,visual-question-answering,visual-reasoning,https://github.com/thilinicooray/context-aware-reasoning-for-sr,1
559,Evade Deep Image Retrieval by Stashing Private Images in the Hash Space,Yanru Xiao,image-retrieval,,,https://github.com/sugarruy/hashstash,1
560,Referring Image Segmentation via Cross-Modal Progressive Comprehension,Shaofei Huang,semantic-segmentation,,,https://github.com/spyflying/CMPC-Refseg,1
561,PointPainting: Sequential Fusion for 3D Object Detection,Sourabh Vora,3d-object-detection,object-detection,self-driving-cars,https://github.com/rshilliday/painting,1
562,Height and Uprightness Invariance for 3D Prediction From a Single View,Manel Baradad,pose-estimation,,,https://github.com/mbaradad/im2pcl,1
563,Generating Accurate Pseudo-Labels in Semi-Supervised Learning and Avoiding Overconfident Predictions via Hermite Polynomial Activations,Vishnu Suresh Lokhande,,,,https://github.com/lokhande-vishnu/DeepHermites,1
564,Phase Consistent Ecological Domain Adaptation,Yanchao Yang,domain-adaptation,semantic-segmentation,unsupervised-domain-adaptation,https://github.com/donglao/PCEDA,1
565,Neural Point Cloud Rendering via Multi-Plane Projection,Peng Dai,,,,https://github.com/daipengwa/NeuralPointCloudRendering,1
566,TBT: Targeted Neural Network Attack With Bit Trojan,Adnan Siraj Rakin,,,,https://github.com/adnansirajrakin/TBT-CVPR2020,1
567,Non-Adversarial Video Synthesis With Learned Priors,Abhishek Aich,,,,https://github.com/abhishekaich27/Navsynth,1
568,Searching for Actions on the Hyperbole,Teng Long,action-recognition-in-videos,video-retrieval,zero-shot-learning,https://github.com/Tenglon/hyperbolic_action,1
569,Unsupervised Adaptation Learning for Hyperspectral Imagery Super-Resolution,Lei Zhang,super-resolution,,,https://github.com/JiangtaoNie/UAL,1
570,Background Data Resampling for Outlier-Aware Classification,Yi Li,,,,https://github.com/JerryYLi/bg-resample-ood,1
571,Recursive Least-Squares Estimator-Aided Online Learning for Visual Tracking,Jin Gao,object-tracking,visual-object-tracking,visual-tracking,https://github.com/Amgao/RLS-RTMDNet,1
572,Towards Inheritable Models for Open-Set Domain Adaptation,Jogendra Nath Kundu,domain-adaptation,,,https://github.com/val-iisc/inheritune,0
573,An Adaptive Neural Network for Unsupervised Mosaic Consistency Analysis in Image Forensics,Quentin Bammey,demosaicking,image-forensics,,https://github.com/qbammey/adaptive_cfa_forensics,0
574,A Unified Optimization Framework for Low-Rank Inducing Penalties,Marcus Valtonen Ornhag,,,,https://github.com/marcusvaltonen/UnifiedFramework,0
575,Putting Visual Object Recognition in Context,Mengmi Zhang,object-recognition,,,https://github.com/kreimanlab/Put-In-Context,0
576,Attentive Weights Generation for Few Shot Learning via Information Maximization,Yiluan Guo,few-shot-image-classification,few-shot-learning,image-classification,https://github.com/Yiluan/AWGIM,0
577,Sparse Layered Graphs for Multi-Object Segmentation,Niels Jeppesen,semantic-segmentation,image-generation,instance-segmentation,https://github.com/Skielex/slgbuilder,0
578,AdderNet: Do We Really Need Multiplications in Deep Learning?,Hanting Chen,,,,https://github.com/PENGUINLIONG/addernet-pytorch,0
579,Towards Verifying Robustness of Neural Networks Against A Family of Semantic Perturbations,Jeet Mohapatra,image-classification,,,https://github.com/JeetMo/Semantify-NN,0
580,Unsupervised Learning From Video With Deep Neural Embeddings,Chengxu Zhuang,object-recognition,,,https://github.com/Chrisackerman1/Unsupervised-Learning-from-Video-with-Deep-Neural-Embeddings,0
581,Robust Design of Deep Neural Networks Against Adversarial Attacks Based on Lyapunov Theory,Arash Rahnama,,,,https://github.com/ArashRahnama/RobustLyapunovDNNs,0
582,Dynamic Fluid Surface Reconstruction Using Deep Neural Network,Simron Thapa,,,,,
583,CvxNet: Learnable Convex Decomposition,Boyang Deng,,,,,
584,"Total3DUnderstanding: Joint Layout, Object Pose and Mesh Reconstruction for Indoor Scenes From a Single Image",Yinyu Nie,,,,,
585,Generating and Exploiting Probabilistic Monocular Depth Estimates,Zhihao Xia,,,,,
586,A Lighting-Invariant Point Processor for Shading,Kathryn Heal,,,,,
587,ActiveMoCap: Optimized Viewpoint Selection for Active Human Motion Capture,Sena Kiciroglu,,,,,
588,Peek-a-Boo: Occlusion Reasoning in Indoor Scenes With Plane Representations,Ziyu Jiang,,,,,
589,Multi-Modal Domain Adaptation for Fine-Grained Action Recognition,Jonathan Munro,,,,,
590,Evolving Losses for Unsupervised Video Representation Learning,AJ Piergiovanni,,,,,
591,Ego-Topo: Environment Affordances From Egocentric Video,Tushar Nagarajan,,,,,
592,Generative Hybrid Representations for Activity Forecasting With No-Regret Learning,Jiaqi Guan,,,,,
593,Predicting Goal-Directed Human Attention Using Inverse Reinforcement Learning,Zhibo Yang,,,,,
594,X3D: Expanding Architectures for Efficient Video Recognition,Christoph Feichtenhofer,,,,,
595,"Use the Force, Luke! Learning to Predict Physical Forces by Simulating Effects",Kiana Ehsani,,,,,
596,The Secret Revealer: Generative Model-Inversion Attacks Against Deep Neural Networks,Yuheng Zhang,,,,,
597,Adversarial Vertex Mixup: Toward Better Adversarially Robust Generalization,Saehyung Lee,,,,,
598,How Does Noise Help Robustness? Explanation and Exploration under the Neural SDE Framework,Xuanqing Liu,,,,,
599,Unpaired Image Super-Resolution Using Pseudo-Supervision,Shunta Maeda,,,,,
600,Robustness Guarantees for Deep Neural Networks on Videos,Min Wu,,,,,
601,Video Modeling With Correlation Networks,Heng Wang,,,,,
602,Projection & Probability-Driven Black-Box Attack,Jie Li,,,,,
603,Auxiliary Training: Towards Accurate and Robust Models,Linfeng Zhang,,,,,
604,A Hierarchical Graph Network for 3D Object Detection on Point Clouds,Jintai Chen,,,,,
605,Learning Generative Models of Shape Handles,Matheus Gadelha,,,,,
606,One Man's Trash Is Another Man's Treasure: Resisting Adversarial Examples by Adversarial Examples,Chang Xiao,,,,,
607,Boundary-Aware 3D Building Reconstruction From a Single Overhead Image,Jisan Mahmud,,,,,
608,Articulation-Aware Canonical Surface Mapping,Nilesh Kulkarni,,,,,
609,BiFuse: Monocular 360 Depth Estimation via Bi-Projection Fusion,Fu-En Wang,,,,,
610,Transformation GAN for Unsupervised Image Synthesis and Representation Learning,Jiayu Wang,,,,,
611,SCT: Set Constrained Temporal Transformer for Set Supervised Action Segmentation,Mohsen Fayyaz,,,,,
612,Front2Back: Single View 3D Shape Reconstruction via Front to Back Prediction,Yuan Yao,,,,,
613,SDC-Depth: Semantic Divide-and-Conquer Network for Monocular Depth Estimation,Lijun Wang,,,,,
614,Single-View View Synthesis With Multiplane Images,Richard Tucker,,,,,
615,Deep Parametric Shape Predictions Using Distance Fields,Dmitriy Smirnov,,,,,
616,Leveraging Photometric Consistency Over Time for Sparsely Supervised Hand-Object Reconstruction,Yana Hasson,,,,,
617,Ensemble Generative Cleaning With Feedback Loops for Defending Adversarial Attacks,Jianhe Yuan,,,,,
618,Temporal Pyramid Network for Action Recognition,Ceyuan Yang,,,,,
619,In Perfect Shape: Certifiably Optimal 3D Shape Reconstruction From 2D Landmarks,Heng Yang,,,,,
620,Towards Transferable Targeted Attack,Maosen Li,,,,,
621,Self-Supervised Human Depth Estimation From Monocular Videos,Feitong Tan,,,,,
622,Recursive Social Behavior Graph for Trajectory Prediction,Jianhua Sun,,,,,
623,Context-Aware and Scale-Insensitive Temporal Repetition Counting,Huaidong Zhang,,,,,
624,OASIS: A Large-Scale Dataset for Single Image 3D in the Wild,Weifeng Chen,,,,,
625,VPLNet: Deep Single View Normal Estimation With Vanishing Points and Lines,Rui Wang,,,,,
626,Intra- and Inter-Action Understanding via Temporal Action Parsing,Dian Shao,,,,,
627,Bundle Pooling for Polygonal Architecture Segmentation Problem,Huayi Zeng,,,,,
628,Defending Against Model Stealing Attacks With Adaptive Misinformation,Sanjay Kariyappa,,,,,
629,Learning to Generate 3D Training Data Through Hybrid Gradient,Dawei Yang,,,,,
630,Cascaded Refinement Network for Point Cloud Completion,Xiaogang Wang,,,,,
631,Learning to Discriminate Information for Online Action Detection,Hyunjun Eun,,,,,
632,Adversarial Examples Improve Image Recognition,Cihang Xie,,,,,
633,Actor-Transformers for Group Activity Recognition,Kirill Gavrilyuk,,,,,
634,Geometry-Aware Satellite-to-Ground Image Synthesis for Urban Areas,Xiaohu Lu,,,,,
635,ZSTAD: Zero-Shot Temporal Activity Detection,Lingling Zhang,,,,,
636,Geometric Structure Based and Regularized Depth Estimation From 360 Indoor Imagery,Lei Jin,,,,,
637,Deep Kinematics Analysis for Monocular 3D Human Pose Estimation,Jingwei Xu,,,,,
638,Scene Recomposition by Learning-Based ICP,Hamid Izadinia,,,,,
639,Single-Step Adversarial Training With Dropout Scheduling,Vivek B.S.,,,,,
640,Deep Non-Line-of-Sight Reconstruction,Javier Grau Chopite,,,,,
641,SSRNet: Scalable 3D Surface Reconstruction Network,Zhenxing Mi,,,,,
642,Progressive Relation Learning for Group Activity Recognition,Guyue Hu,,,,,
643,Adversarial Camouflage: Hiding Physical-World Attacks With Natural Styles,Ranjie Duan,,,,,
644,Polishing Decision-Based Adversarial Noise With a Customized Sampling,Yucheng Shi,,,,,
645,Focus on Defocus: Bridging the Synthetic to Real Domain Gap for Depth Estimation,Maxim Maximov,,,,,
646,Active Vision for Early Recognition of Human Actions,Boyu Wang,,,,,
647,Exploiting Joint Robustness to Adversarial Perturbations,Ali Dabouei,,,,,
648,Boosting the Transferability of Adversarial Samples via Attention,Weibin Wu,,,,,
649,ActionBytes: Learning From Trimmed Videos to Localize Actions,Mihir Jain,,,,,
650,Efficient Adversarial Training With Transferable Adversarial Examples,Haizhong Zheng,,,,,
651,Alleviation of Gradient Exploding in GANs: Fake Can Be Real,Song Tao,,,,,
652,Achieving Robustness in the Wild via Adversarial Mixing With Disentangled Representations,Sven Gowal,,,,,
653,QEBA: Query-Efficient Boundary-Based Blackbox Attack,Huichen Li,,,,,
654,Learning to Simulate Dynamic Environments With GameGAN,Seung Wook Kim,,,,,
655,SDFDiff: Differentiable Rendering of Signed Distance Fields for 3D Shape Optimization,Yue Jiang,,,,,
656,Through the Looking Glass: Neural 3D Reconstruction of Transparent Shapes,Zhengqin Li,,,,,
657,TextureFusion: High-Quality Texture Acquisition for Real-Time RGB-D Scanning,Joo Ho Lee,,,,,
658,"D3VO: Deep Depth, Deep Pose and Deep Uncertainty for Monocular Visual Odometry",Nan Yang,,,,,
659,Deep Implicit Volume Compression,Danhang Tang,,,,,
660,"MAGSAC++, a Fast, Reliable and Accurate Robust Estimator",Daniel Barath,,,,,
661,OctSqueeze: Octree-Structured Entropy Model for LiDAR Compression,Lila Huang,,,,,
662,4D Association Graph for Realtime Multi-Person Motion Capture Using Multiple Video Cameras,Yuxiang Zhang,,,,,
663,Robust 3D Self-Portraits in Seconds,Zhe Li,,,,,
664,Learning to Have an Ear for Face Super-Resolution,Givi Meishvili,,,,,
665,Deep Optics for Single-Shot High-Dynamic-Range Imaging,Christopher A. Metzler,,,,,
666,Learning Rank-1 Diffractive Optics for Single-Shot High Dynamic Range Imaging,Qilin Sun,,,,,
667,Non-Line-of-Sight Surface Reconstruction Using the Directional Light-Cone Transform,Sean I. Young,,,,,
668,Seeing the World in a Bag of Chips,Jeong Joon Park,,,,,
669,Retina-Like Visual Image Reconstruction via Spiking Neural Model,Lin Zhu,,,,,
