,title,author,task 1,task 2,task 3,github,stars
309,CONSAC: Robust Multi-Model Fitting by Conditional Sample Consensus,Florian Kluger,homography-estimation,self-supervised-learning,,https://github.com/fkluger/consac,31
310,From Patches to Pictures (PaQ-2-PiQ): Mapping the Perceptual Space of Picture Quality,Zhenqiang Ying,,,,https://github.com/baidut/PaQ-2-PiQ,31
311,How Useful Is Self-Supervised Pretraining for Visual Tasks?,Alejandro Newell,imitation-learning,monocular-depth-estimation,representation-learning,https://github.com/princeton-vl/selfstudy,30
312,Group Sparsity: The Hinge Between Filter Pruning and Decomposition for Network Compression,Yawei Li,image-classification,image-super-resolution,neural-network-compression,https://github.com/ofsoundof/group_sparsity,30
313,Hierarchical Human Parsing With Typed Part-Relation Reasoning,Wenguan Wang,human-parsing,,,https://github.com/hlzhu09/Hierarchical-Human-Parsing,30
314,Enhanced Blind Face Restoration With Multi-Exemplar Images and Adaptive Spatial Feature Fusion,Xiaoming Li,image-reconstruction,,,https://github.com/csxmli2016/ASFFNet,30
315,Embedding Expansion: Augmentation in Embedding Space for Deep Metric Learning,Byungsoo Ko,image-retrieval,metric-learning,,https://github.com/clovaai/embedding-expansion,30
316,Learning for Video Compression With Hierarchical Quality and Recurrent Enhancement,Ren Yang,image-compression,video-compression,,https://github.com/RenYang-home/HLVC,30
317,SESS: Self-Ensembling Semi-Supervised 3D Object Detection,Na Zhao,3d-object-detection,image-classification,object-detection,https://github.com/Na-Z/sess,30
318,Multi-Scale Interactive Network for Salient Object Detection,Youwei Pang,saliency-detection,salient-object-detection,,https://github.com/lartpang/MINet,29
319,Uncertainty-Aware CNNs for Depth Completion: Uncertainty from Beginning to End,Abdelrahman Eldesokey,depth-completion,,,https://github.com/abdo-eldesokey/pncnn,29
320,REVERIE: Remote Embodied Visual Referring Expression in Real Indoor Environments,Yuankai Qi,,,,https://github.com/YuankaiQi/REVERIE,29
321,Cost Volume Pyramid Based Depth Inference for Multi-View Stereo,Jiayu Yang,,,,https://github.com/JiayuYANG/CVP-MVSNet,29
322,Bodies at Rest: 3D Human Pose and Shape Estimation From a Pressure Image Using Synthetic Data,Henry M. Clever,image-generation,,,https://github.com/Healthcare-Robotics/bodies-at-rest,29
323,DaST: Data-Free Substitute Training for Adversarial Attacks,Mingyi Zhou,,,,https://github.com/zhoumingyi/DaST,28
324,Dynamic Multiscale Graph Neural Networks for 3D Skeleton Based Human Motion Prediction,Maosen Li,3d-human-pose-estimation,3d-pose-estimation,human-motion-prediction,https://github.com/limaosen0/DMGNN,28
325,Fusion-Aware Point Convolution for Online Semantic 3D Scene Segmentation,Jiazhao Zhang,scene-segmentation,,,https://github.com/jzhzhang/FusionAwareConv,28
326,Visual Grounding in Video for Unsupervised Word Translation,Gunnar A. Sigurdsson,,,,https://github.com/gsig/visual-grounding,28
327,3DV: 3D Dynamic Voxel for Action Recognition in Depth Video,Yancheng Wang,3d-human-action-recognition,,,https://github.com/3huo/3DV-Action,28
328,ACNe: Attentive Context Normalization for Robust Permutation-Equivariant Learning,Weiwei Sun,pose-estimation,,,https://github.com/vcg-uvic/acne,27
329,Learning Saliency Propagation for Semi-Supervised Instance Segmentation,Yanzhao Zhou,instance-segmentation,object-detection,semantic-segmentation,https://github.com/ucbdrive/ShapeProp,27
330,Category-Level Articulated Object Pose Estimation,Xiaolong Li,pose-estimation,,,https://github.com/dragonlong/articulated-pose,27
331,A Neural Rendering Framework for Free-Viewpoint Relighting,Zhang Chen,3d-reconstruction,image-generation,,https://github.com/LansburyCH/relightable-nr,27
332,Multi-Scale Boosted Dehazing Network With Dense Feature Fusion,Hang Dong,,,,https://github.com/BookerDeWitt/MSBDN-DFF,27
333,Semantic Drift Compensation for Class-Incremental Learning,Lu Yu,,,,https://github.com/yulu0724/SDC-IL,26
334,AutoTrack: Towards High-Performance Visual Tracking for UAV With Automatic Spatio-Temporal Regularization,Yiming Li,visual-tracking,,,https://github.com/vision4robotics/AutoTrack,26
335,Extremely Dense Point Correspondences Using a Learned Feature Descriptor,Xingtong Liu,3d-reconstruction,optical-flow-estimation,,https://github.com/lppllppl920/DenseDescriptorLearning-Pytorch,26
336,IntrA: 3D Intracranial Aneurysm Dataset for Deep Learning,Xi Yang,,,,https://github.com/intra3d2019/IntrA,26
337,PQ-NET: A Generative Part Seq2Seq Network for 3D Shapes,Rundi Wu,3d-reconstruction,single-view-3d-reconstruction,,https://github.com/ChrisWu1997/PQ-NET,26
338,Dual Super-Resolution Learning for Semantic Segmentation,Li Wang,image-super-resolution,pose-estimation,semantic-segmentation,https://github.com/wanglixilinx/DSRL,25
339,Transfer Learning From Synthetic to Real-Noise Denoising With Adaptive Instance Normalization,Yoonsik Kim,denoising,transfer-learning,,https://github.com/terryoo/AINDNet,25
340,Tangent Images for Mitigating Spherical Distortion,Marc Eder,,,,https://github.com/meder411/Tangent-Images,25
341,Gradually Vanishing Bridge for Adversarial Domain Adaptation,Shuhao Cui,domain-adaptation,unsupervised-domain-adaptation,,https://github.com/cuishuhao/GVB,25
342,AOWS: Adaptive and Optimal Network Width Search With Latency Constraints,Maxim Berman,architecture-search,,,https://github.com/bermanmaxim/AOWS,25
343,Local-Global Video-Text Interactions for Temporal Grounding,Jonghwan Mun,,,,https://github.com/JonghwanMun/LGI4temporalgrounding,25
344,AugFPN: Improving Multi-Scale Feature Learning for Object Detection,Chaoxu Guo,object-detection,,,https://github.com/Gus-Guo/AugFPN,25
345,Instance Segmentation of Biological Images Using Harmonic Embeddings,Victor Kulikov,instance-segmentation,semantic-segmentation,,https://github.com/kulikovv/harmonic,24
346,Transform and Tell: Entity-Aware News Image Captioning,Alasdair Tran,image-captioning,language-modelling,,https://github.com/alasdairtran/transform-and-tell,24
347,More Grounded Image Captioning by Distilling Image-Text Matching Model,Yuanen Zhou,image-captioning,text-matching,,https://github.com/YuanEZhou/Grounded-Image-Captioning,24
348,Fusing Wearable IMUs With Multi-View Images for Human Pose Estimation: A Geometric Approach,Zhe Zhang,3d-absolute-human-pose-estimation,3d-human-pose-estimation,pose-estimation,https://github.com/CHUNYUWANG/imu-human-pose-pytorch,24
349,Semi-Supervised Learning for Few-Shot Image-to-Image Translation,Yaxing Wang,few-shot-learning,image-to-image-translation,object-classification,https://github.com/yaxingwang/SEMIT,23
350,xMUDA: Cross-Modal Unsupervised Domain Adaptation for 3D Semantic Segmentation,Maximilian Jaritz,3d-semantic-segmentation,autonomous-driving,domain-adaptation,https://github.com/valeoai/xmuda,23
351,Computing the Testing Error Without a Testing Set,Ciprian A. Corneanu,causal-discovery,model-selection,,https://github.com/cipriancorneanu/dnn-topology,23
352,Regularizing Class-Wise Predictions via Self-Knowledge Distillation,Sukmin Yun,calibration,image-classification,,https://github.com/alinlab/cs-kd,23
353,GNN3DMOT: Graph Neural Network for 3D Multi-Object Tracking With 2D-3D Multi-Feature Learning,Xinshuo Weng,3d-multi-object-tracking,multi-object-tracking,object-tracking,https://github.com/xinshuoweng/GNN3DMOT,22
354,Dynamic Convolutions: Exploiting Spatial Sparsity for Faster Inference,Thomas Verelst,image-classification,pose-estimation,,https://github.com/thomasverelst/dynconv,22
355,Instance Shadow Detection,Tianyu Wang,shadow-detection,,,https://github.com/stevewongv/InstanceShadowDetection,22
356,Interactive Object Segmentation With Inside-Outside Guidance,Shiyin Zhang,instance-segmentation,semantic-segmentation,,https://github.com/shiyinzhang/Inside-Outside-Guidance,22
357,Recurrent Feature Reasoning for Image Inpainting,Jingyuan Li,image-inpainting,,,https://github.com/jingyuanli001/RFR-Inpainting,22
358,StructEdit: Learning Structural Shape Variations,Kaichun Mo,,,,https://github.com/daerduoCarey/structedit,22
359,Weakly Supervised Semantic Point Cloud Segmentation: Towards 10x Fewer Labels,Xun Xu,,,,https://github.com/alex-xun-xu/WeakSupPointCloudSeg,22
360,Cooling-Shrinking Attack: Blinding the Tracker With Imperceptible Noises,Bin Yan,adversarial-attack,,,https://github.com/MasterBin-IIAU/CSA,22
361,GPS-Net: Graph Property Sensing Network for Scene Graph Generation,Xin Lin,graph-generation,scene-graph-generation,,https://github.com/taksau/GPS-Net,21
362,Orthogonal Convolutional Neural Networks,Jiayun Wang,speech-recognition,person-re-identification,,https://github.com/samaonline/Orthogonal-Convolutional-Neural-Networks,21
363,Syn2Real Transfer Learning for Image Deraining Using Gaussian Processes,Rajeev Yasarla,gaussian-processes,rain-removal,transfer-learning,https://github.com/rajeevyasarla/Syn2Real,21
364,Sign Language Transformers: Joint End-to-End Sign Language Recognition and Translation,Necati Cihan Camgoz,machine-translation,sign-language-recognition,sign-language-translation,https://github.com/neccam/slt,21
365,Satellite Image Time Series Classification With Pixel-Set Encoders and Temporal Self-Attention,Vivien Sainte Fare Garnot,time-series,time-series-classification,,https://github.com/VSainteuf/psetae,21
366,Conditional Gaussian Distribution Learning for Open Set Recognition,Xin Sun,open-set-learning,,,https://github.com/BraveGump/CGDL-for-Open-Set-Recognition,21
367,Counterfactual Samples Synthesizing for Robust Visual Question Answering,Long Chen,question-answering,visual-question-answering,,https://github.com/yanxinzju/CSS-VQA,20
368,Correction Filter for Single Image Super-Resolution: Robustifying Off-the-Shelf Deep Super-Resolvers,Shady Abu Hussein,image-super-resolution,super-resolution,,https://github.com/shadyabh/Correction-Filter,20
369,Flow2Stereo: Effective Self-Supervised Learning of Optical Flow and Stereo Matching,Pengpeng Liu,optical-flow-estimation,self-supervised-learning,stereo-matching-1,https://github.com/ppliuboy/Flow2Stereo,20
370,Towards Learning Structure via Consensus for Face Segmentation and Parsing,Iacopo Masi,,,,https://github.com/isi-vista/structure_via_consensus,20
371,Combating Noisy Labels by Agreement: A Joint Training Method with Co-Regularization,Hongxin Wei,,,,https://github.com/hongxin001/JoCoR,20
372,A Model-Driven Deep Neural Network for Single Image Rain Removal,Hong Wang,dictionary-learning,rain-removal,single-image-deraining,https://github.com/hongwang01/RCDNet,20
373,Instance Credibility Inference for Few-Shot Learning,Yikai Wang,data-augmentation,few-shot-learning,meta-learning,https://github.com/Yikai-Wang/ICI-FSL,20
374,Extreme Relative Pose Network Under Hybrid Representations,Zhenpei Yang,pose-estimation,,,https://github.com/SimingYan/Hybrid_Relative_Pose,20
375,MLCVNet: Multi-Level Context VoteNet for 3D Object Detection,Qian Xie,3d-object-detection,object-detection,,https://github.com/NUAAXQ/MLCVNet,20
376,Symmetry and Group in Attribute-Object Compositions,Yong-Lu Li,compositional-zero-shot-learning,zero-shot-learning,,https://github.com/DirtyHarryLYL/SymNet,20
377,Semi-Supervised Semantic Segmentation With Cross-Consistency Training,Yassine Ouali,semantic-segmentation,semi-supervised-semantic-segmentation,,https://github.com/yassouali/CCT,19
378,Learning to Segment the Tail,Xinting Hu,image-classification,instance-segmentation,object-detection,https://github.com/JoyHuYY1412/LST_LVIS,19
379,Rethinking Differentiable Search for Mixed-Precision Neural Networks,Zhaowei Cai,combinatorial-optimization,,,https://github.com/zhaoweicai/EdMIPS,18
380,Graph Structured Network for Image-Text Matching,Chunxiao Liu,text-matching,,,https://github.com/CrossmodalGroup/GSMN,18
381,Learning Human-Object Interaction Detection Using Interaction Points,Tiancai Wang,action-detection,action-localization,spatio-temporal-action-localization,https://github.com/vaesl/IP-Net,17
382,Holistically-Attracted Wireframe Parsing,Nan Xue,line-segment-detection,,,https://github.com/cherubicXN/hawp,17
383,Benchmarking Adversarial Robustness on Image Classification,Yinpeng Dong,image-classification,person-re-identification,image-classification,https://github.com/thu-ml/realsafe,16
384,SAL: Sign Agnostic Learning of Shapes From Raw Data,Matan Atzmon,,,,https://github.com/matanatz/SAL,16
385,Video Super-Resolution With Temporal Group Attention,Takashi Isobe,super-resolution,video-super-resolution,,https://github.com/junpan19/VSR_TGA,16
386,Learning to Structure an Image With Few Colors,Yunzhong Hou,image-compression,quantization,,https://github.com/hou-yz/color_distillation,16
387,Making Better Mistakes: Leveraging Class Hierarchies With Deep Networks,Luca Bertinetto,image-classification,,,https://github.com/fiveai/making-better-mistakes,16
388,AdversarialNAS: Adversarial Neural Architecture Search for GANs,Chen Gao,image-generation,architecture-search,,https://github.com/chengaopro/AdversarialNAS,16
389,Norm-Aware Embedding for Efficient Person Search,Di Chen,human-detection,person-re-identification,person-search,https://github.com/DeanChan/NAE4PS,16
390,Attentive Normalization for Conditional Image Generation,Yi Wang,gaze-estimation,image-to-image-translation,semantic-similarity,https://github.com/shepnerd/AttenNorm,15
391,Regularizing Neural Networks via Minimizing Hyperspherical Energy,Rongmei Lin,,,,https://github.com/rmlin/CoMHE,15
392,Face X-Ray for More General Face Forgery Detection,Lingzhi Li,deepfake-detection,face-swapping,,https://github.com/neverUseThisName/Face-X-Ray,15
393,Interactive Two-Stream Decoder for Accurate and Fast Saliency Detection,Huajun Zhou,saliency-detection,,,https://github.com/moothes/ITSD-pytorch,15
394,Deep Homography Estimation for Dynamic Scenes,Hoang Le,homography-estimation,multi-task-learning,,https://github.com/lcmhoang/hmg-dynamics,15
395,Skeleton-Based Action Recognition With Shift Graph Convolutional Network,Ke Cheng,skeleton-based-action-recognition,,,https://github.com/kchengiva/Shift-GCN,15
396,Upgrading Optical Flow to 3D Scene Flow Through Optical Expansion,Gengshan Yang,depth-estimation,optical-flow-estimation,,https://github.com/gengshan-y/expansion,15
397,Hi-CMD: Hierarchical Cross-Modality Disentanglement for Visible-Infrared Person Re-Identification,Seokeon Choi,image-generation,person-re-identification,,https://github.com/bismex/HiCMD,15
398,What Deep CNNs Benefit From Global Covariance Pooling: An Optimization Perspective,Qilong Wang,instance-segmentation,object-detection,semantic-segmentation,https://github.com/ZhangLi-CS/GCP_Optimization,15
399,Deep Geometric Functional Maps: Robust Feature Learning for Shape Correspondence,Nicolas Donati,,,,https://github.com/LIX-shape-analysis/GeomFmaps,15
400,From Image Collections to Point Clouds With Self-Supervised Shape and Pose Networks,K L Navaneet,3d-object-reconstruction,3d-object-reconstruction-from-a-single-image,object-reconstruction,https://github.com/val-iisc/ssl_3d_recon,14
401,Scene-Adaptive Video Frame Interpolation via Meta-Learning,Myungsub Choi,meta-learning,video-frame-interpolation,,https://github.com/myungsub/meta-interpolation,14
402,Semantics-Guided Neural Networks for Efficient Skeleton-Based Human Action Recognition,Pengfei Zhang,skeleton-based-action-recognition,action-recognition,,https://github.com/microsoft/SGN,14
403,VOLDOR: Visual Odometry From Log-Logistic Dense Optical Flow Residuals,Zhixiang Min,optical-flow-estimation,visual-odometry,,https://github.com/htkseason/VOLDOR,14
404,Single-Stage 6D Object Pose Estimation,Yinlin Hu,6d-pose-estimation,pose-estimation,pose-prediction,https://github.com/cvlab-epfl/single-stage-pose,14
405,MiLeNAS: Efficient Neural Architecture Search via Mixed-Level Reformulation,Chaoyang He,bilevel-optimization,architecture-search,,https://github.com/chaoyanghe/MiLeNAS,14
406,SAM: The Sensitivity of Attribution Methods to Hyperparameters,Naman Bansal,,,,https://github.com/anguyen8/sam,14
407,Towards Large Yet Imperceptible Adversarial Image Perturbations With Perceptual Color Distance,Zhengyu Zhao,image-classification,,,https://github.com/ZhengyuZhao/PerC-Adversarial,14
408,Weakly-Supervised Semantic Segmentation via Sub-Category Exploration,Yu-Ting Chang,semantic-segmentation,weakly-supervised-semantic-segmentation,,https://github.com/Juliachang/SC-CAM,14
409,RGBD-Dog: Predicting Canine Pose from RGBD Sensors,Sinead Kearney,motion-capture,pose-estimation,pose-prediction,https://github.com/CAMERA-Bath/RGBD-Dog,14
410,Deep Stereo Using Adaptive Thin Volume Representation With Uncertainty Awareness,Shuo Cheng,3d-reconstruction,,,https://github.com/touristCheng/UCSNet,13
411,On Isometry Robustness of Deep 3D Point Cloud Models Under Adversarial Attacks,Yue Zhao,,,,https://github.com/skywalker6174/3d-isometry-robust,13
412,Unsupervised Multi-Modal Image Registration via Geometry Preserving Image-to-Image Translation,Moab Arar,autonomous-driving,image-registration,image-to-image-translation,https://github.com/moabarar/nemar,13
413,JL-DCF: Joint Learning and Densely-Cooperative Fusion Framework for RGB-D Salient Object Detection,Keren Fu,object-detection,salient-object-detection,,https://github.com/kerenfu/JLDCF,13
414,"Classifying, Segmenting, and Tracking Object Instances in Video with Mask Propagation",Gedas Bertasius,instance-segmentation,semantic-segmentation,,https://github.com/jiawen9611/Awesome-Video-Instance-Segmentation,13
415,Meshlet Priors for 3D Mesh Reconstruction,Abhishek Badki,,,,https://github.com/NVlabs/meshlets,13
416,3D Part Guided Image Editing for Fine-Grained Object Understanding,Zongdai Liu,autonomous-driving,instance-segmentation,semantic-segmentation,https://github.com/zongdai/EditingForDNN,12
417,3D Human Mesh Regression With Dense Correspondence,Wang Zeng,,,,https://github.com/zengwang430521/DecoMR,12
418,Disentangling Physical Dynamics From Unknown Factors for Unsupervised Video Prediction,Vincent Le Guen,video-prediction,,,https://github.com/vincent-leguen/PhyDNet,12
419,IDA-3D: Instance-Depth-Aware 3D Object Detection From Stereo Vision for Autonomous Driving,Wanli Peng,3d-object-detection,autonomous-driving,depth-estimation,https://github.com/swords123/IDA-3D,12
420,Domain-Aware Visual Bias Eliminating for Generalized Zero-Shot Learning,Shaobo Min,zero-shot-learning,,,https://github.com/mboboGO/DVBE,12
421,Attention Mechanism Exploits Temporal Contexts: Real-Time 3D Human Pose Reconstruction,Ruixu Liu,3d-human-pose-estimation,pose-estimation,,https://github.com/lrxjason/Attention3DHumanPose,12
422,Multi-Scale Progressive Fusion Network for Single Image Deraining,Kui Jiang,rain-removal,single-image-deraining,,https://github.com/kuihua/MSPFN,12
423,Light Field Spatial Super-Resolution via Deep Combinatorial Geometry Embedding and Structural Consistency Regularization,Jing Jin,super-resolution,,,https://github.com/jingjin25/LFSSR-ATO,12
424,MUXConv: Information Multiplexing in Convolutional Neural Networks,Zhichao Lu,image-classification,architecture-search,object-detection,https://github.com/human-analysis/MUXConv,12
425,A Multi-Hypothesis Approach to Color Constancy,Daniel Hernandez-Juarez,color-constancy,,,https://github.com/huawei-noah/multi_hyp_cc,12
426,Learning When and Where to Zoom With Deep Reinforcement Learning,Burak Uzkent,object-detection,region-proposal,,https://github.com/ermongroup/PatchDrop,12
427,3D Sketch-Aware Semantic Scene Completion via Semi-Supervised Structure Prior,Xiaokang Chen,,,,https://github.com/charlesCXK/3D-SketchAware-SSC,12
428,Exploring Data Aggregation in Policy Learning for Vision-Based Urban Autonomous Driving,Aditya Prakash,imitation-learning,,,https://github.com/autonomousvision/data_aggregation,12
429,SPARE3D: A Dataset for SPAtial REasoning on Three-View Line Drawings,Wenyu Han,,,,https://github.com/ai4ce/SPARE3D,12
430,Graph-Guided Architecture Search for Real-Time Semantic Segmentation,Peiwen Lin,real-time-semantic-segmentation,semantic-segmentation,,https://github.com/L-Lighter/LightNet,12
431,Learning From Synthetic Animals,Jiteng Mu,edge-detection,object-detection,synthetic-data-generation,https://github.com/JitengMu/Learning-from-Synthetic-Animals,12
432,Deep Residual Flow for Out of Distribution Detection,Ev Zisselman,out-of-distribution-detection,,,https://github.com/EvZissel/Residual-Flow,12
433,Image Demoireing with Learnable Bandpass Filters,Bolun Zheng,image-restoration,,,https://github.com/zhenngbolun/Learnbale_Bandpass_Filter,11
434,Plug-and-Play Algorithms for Large-Scale Snapshot Compressive Imaging,Xin Yuan,denoising,,,https://github.com/liuyang12/PnP-SCI,11
435,Cross-Domain Document Object Detection: Benchmark Suite and Method,Kai Li,object-detection,,,https://github.com/kailigo/cddod,11
436,Revisiting Pose-Normalization for Fine-Grained Few-Shot Recognition,Luming Tang,,,,https://github.com/Tsingularity/PoseNorm_Fewshot,11
437,Discovering Human Interactions With Novel Objects via Zero-Shot Learning,Suchen Wang,human-object-interaction-detection,region-proposal,zero-shot-learning,https://github.com/scwangdyd/zero_shot_hoi,10
438,ARShadowGAN: Shadow Generative Adversarial Network for Augmented Reality in Single Light Scenes,Daquan Liu,,,,https://github.com/ldq9526/ARShadowGAN,10
439,A Novel Recurrent Encoder-Decoder Structure for Large-Scale Multi-View Stereo Reconstruction From an Open Aerial Dataset,Jin Liu,,,,https://github.com/gpcv-liujin/REDNet,10
440,Learning Dynamic Relationships for 3D Human Motion Prediction,Qiongjie Cui,human-motion-prediction,motion-prediction,,https://github.com/cuiqiongjie/LDRGCN,10
441,Adaptive Subspaces for Few-Shot Learning,Christian Simon,few-shot-image-classification,few-shot-learning,meta-learning,https://github.com/chrysts/dsn_fewshot,10
442,ScrabbleGAN: Semi-Supervised Varying Length Handwritten Text Generation,Sharon Fogel,domain-adaptation,handwriting-recognition,optical-character-recognition,https://github.com/amzn/convolutional-handwriting-gan,10
443,Graph Embedded Pose Clustering for Anomaly Detection,Amir Markovitz,anomaly-detection,,,https://github.com/amirmk89/gepc,10
444,Weakly Supervised Visual Semantic Parsing,Alireza Zareian,graph-generation,image-retrieval,scene-graph-generation,https://github.com/alirezazareian/vspnet,10
445,Hyperbolic Visual Embedding Learning for Zero-Shot Recognition,Shaoteng Liu,zero-shot-learning,,,https://github.com/ShaoTengLiu/Hyperbolic_ZSL,10
446,Scalability in Perception for Autonomous Driving: Waymo Open Dataset,Pei Sun,autonomous-driving,,,https://github.com/JdeRobot/BehaviorSuite,10
447,Single Image Reflection Removal Through Cascaded Refinement,Chao Li,community-detection,,,https://github.com/JHL-HUST/IBCLN,10
448,MetaIQA: Deep Meta-Learning for No-Reference Image Quality Assessment,Hancheng Zhu,image-quality-assessment,meta-learning,no-reference-image-quality-assessment,https://github.com/zhuhancheng/MetaIQA,9
449,WCP: Worst-Case Perturbations for Semi-Supervised Deep Learning,Liheng Zhang,,,,https://github.com/maple-research-lab/WCP,9
450,Semantic Image Manipulation Using Scene Graphs,Helisa Dhamo,image-generation,layout-to-image-generation,,https://github.com/he-dhamo/simsg,9
451,Action Modifiers: Learning From Adverbs in Instructional Videos,Hazel Doughty,,,,https://github.com/hazeld/action-modifiers,9
452,CIAGAN: Conditional Identity Anonymization Generative Adversarial Networks,Maxim Maximov,,,,https://github.com/dvl-tum/ciagan,9
453,PointGMM: A Neural GMM Network for Point Clouds,Amir Hertz,,,,https://github.com/amirhertz/pointgmm,9
454,Autolabeling 3D Objects With Differentiable Rendering of SDF Shape Priors,Sergey Zakharov,,,,https://github.com/TRI-ML/sdflabel,9
455,Syntax-Aware Action Targeting for Video Captioning,Qi Zheng,video-captioning,,,https://github.com/SydCaption/SAAT,9
456,A2dele: Adaptive and Attentive Depth Distiller for Efficient RGB-D Salient Object Detection,Yongri Piao,object-detection,saliency-detection,salient-object-detection,https://github.com/OIPLab-DUT/CVPR2020-A2dele,9
457,Sketch Less for More: On-the-Fly Fine-Grained Sketch-Based Image Retrieval,Ayan Kumar Bhunia,cross-modal-retrieval,image-retrieval,sketch-based-image-retrieval,https://github.com/AyanKumarBhunia/on-the-fly-FGSBIR,9
458,Video Playback Rate Perception for Self-Supervised Spatio-Temporal Representation Learning,Yuan Yao,representation-learning,video-retrieval,,https://github.com/yuanyao366/PRP,8
459,Normalizing Flows With Multi-Scale Autoregressive Priors,Apratim Bhattacharyya,density-estimation,image-generation,,https://github.com/visinf/mar-scf,8
460,Smooth Shells: Multi-Scale Shape Registration With Functional Maps,Marvin Eisenberger,,,,https://github.com/marvin-eisenberger/smooth-shells,8
461,Learning Integral Objects With Intra-Class Discriminator for Weakly-Supervised Semantic Segmentation,Junsong Fan,semantic-segmentation,weakly-supervised-semantic-segmentation,,https://github.com/js-fan/ICD,8
462,Controllable Orthogonalization in Training DNNs,Lei Huang,image-classification,,,https://github.com/huangleiBuaa/ONI,8
463,Deep Active Learning for Biased Datasets via Fisher Kernel Self-Supervision,Denis Gudovskiy,active-learning,,,https://github.com/gudovskiy/al-fk-self-supervision,8
464,HCNAF: Hyper-Conditioned Neural Autoregressive Flow and its Application for Probabilistic Occupancy Map Forecasting,Geunseob Oh,density-estimation,,,https://github.com/gsoh/HCNAF,8
465,A Context-Aware Loss Function for Action Spotting in Soccer Videos,Anthony Cioppa,action-classification,action-detection,action-spotting,https://github.com/cioppaanthony/context-aware-loss,8
466,Multiple Anchor Learning for Visual Object Detection,Wei Ke,multiple-instance-learning,object-detection,,https://github.com/KevinKecc/MAL,8
467,Diversified Arbitrary Style Transfer via Deep Feature Perturbation,Zhizhong Wang,image-reconstruction,style-transfer,,https://github.com/EndyWon/Deep-Feature-Perturbation,8
