,title,author,task 1,task 2,task 3,github,stars
670,Neural Network Pruning With Residual-Connections and Limited-Data,Jian-Hao Luo,,,,,
671,Training Quantized Neural Networks With a Full-Precision Auxiliary Module,Bohan Zhuang,,,,,
672,Neural Networks Are More Productive Teachers Than Human Raters: Active Mixup for Data-Efficient Knowledge Distillation From a Blackbox Model,Dongdong Wang,,,,,
673,Multi-Dimensional Pruning: A Unified Framework for Model Compression,Jinyang Guo,,,,,
674,Synchronizing Probability Measures on Rotations via Optimal Transport,Tolga Birdal,,,,,
675,Attention-Aware Multi-View Stereo,Keyang Luo,,,,,
676,Joint Filtering of Intensity Images and Neuromorphic Events for High-Resolution Noise-Robust Imaging,Zihao W. Wang,,,,,
677,HVNet: Hybrid Voxel Network for LiDAR Based 3D Object Detection,Maosheng Ye,,,,,
678,Frequency Domain Compact 3D Convolutional Neural Networks,Hanting Chen,,,,,
679,Single-Image HDR Reconstruction by Learning to Reverse the Camera Pipeline,Yu-Lun Liu,,,,,
680,DNU: Deep Non-Local Unrolling for Computational Spectral Imaging,Lizhi Wang,,,,,
681,Single Image Optical Flow Estimation With an Event Camera,Liyuan Pan,,,,,
682,Multi-View Neural Human Rendering,Minye Wu,,,,,
683,Depth Sensing Beyond LiDAR Range,Kai Zhang,,,,,
684,Event Probability Mask (EPM) and Event Denoising Convolutional Neural Network (EDnCNN) for Neuromorphic Cameras,R. Wes Baldwin,,,,,
685,Self-Learning Video Rain Streak Removal: When Cyclic Consistency Meets Temporal Correspondence,Wenhan Yang,,,,,
686,Neuromorphic Camera Guided High Dynamic Range Imaging,Jin Han,,,,,
687,Polarized Reflection Removal With Perfect Alignment in the Wild,Chenyang Lei,,,,,
688,A Sparse Resultant Based Method for Efficient Minimal Solvers,Snehal Bhayani,,,,,
689,A Semi-Supervised Assessor of Neural Architectures,Yehui Tang,,,,,
690,Learning a Reinforced Agent for Flexible Exposure Bracketing Selection,Zhouxia Wang,,,,,
691,Joint 3D Instance Segmentation and Object Detection for Autonomous Driving,Dingfu Zhou,,,,,
692,TomoFluid: Reconstructing Dynamic Fluid From Sparse View Videos,Guangming Zang,,,,,
693,Self2Self With Dropout: Learning Self-Supervised Denoising From Single Image,Yuhui Quan,,,,,
694,Discrete Model Compression With Resource Constraint for Deep Neural Networks,Shangqian Gao,,,,,
695,Structured Compression by Weight Encryption for Unstructured Pruning and Quantization,Se Jung Kwon,,,,,
696,End-to-End Learning Local Multi-View Descriptors for 3D Point Clouds,Lei Li,,,,,
697,Minimal Solutions for Relative Pose With a Single Affine Correspondence,Banglei Guan,,,,,
698,Point Cloud Completion by Skip-Attention Network With Hierarchical Folding,Xin Wen,,,,,
699,Towards Unified INT8 Training for Convolutional Neural Network,Feng Zhu,,,,,
700,Active 3D Motion Visualization Based on Spatiotemporal Light-Ray Integration,Fumihiko Sakaue,,,,,
701,GreedyNAS: Towards Fast One-Shot NAS With Greedy Supernet,Shan You,,,,,
702,Learning Filter Pruning Criteria for Deep Convolutional Neural Networks Acceleration,Yang He,,,,,
703,DIST: Rendering Deep Implicit Signed Distance Function With Differentiable Sphere Tracing,Shaohui Liu,,,,,
704,Visually Imbalanced Stereo Matching,Yicun Liu,,,,,
705,Mesh-Guided Multi-View Stereo With Pyramid Architecture,Yuesong Wang,,,,,
706,BiDet: An Efficient Binarized Object Detector,Ziwei Wang,,,,,
707,Local Non-Rigid Structure-From-Motion From Diffeomorphic Mappings,Shaifali Parashar,,,,,
708,Seeing Around Street Corners: Non-Line-of-Sight Detection and Tracking In-the-Wild Using Doppler Radar,Nicolas Scheiner,,,,,
709,"APQ: Joint Search for Network Architecture, Pruning and Quantization Policy",Tianzhe Wang,,,,,
710,On the Acceleration of Deep Learning Model Parallelism With Staleness,An Xu,,,,,
711,RevealNet: Seeing Behind Objects in RGB-D Scans,Ji Hou,,,,,
712,MemNAS: Memory-Efficient Neural Architecture Search With Grow-Trim Learning,Peiye Liu,,,,,
713,Polarized Non-Line-of-Sight Imaging,Kenichiro Tanaka,,,,,
714,AdaBits: Neural Network Quantization With Adaptive Bit-Widths,Qing Jin,,,,,
715,ClusterVO: Clustering Moving Instances and Estimating Visual Odometry for Self and Surroundings,Jiahui Huang,,,,,
716,Automatic Neural Network Compression by Sparsity-Quantization Joint Learning: A Constrained Optimization-Based Approach,Haichuan Yang,,,,,
717,Normal Assisted Stereo Depth Estimation,Uday Kusupati,,,,,
718,gDLS*: Generalized Pose-and-Scale Estimation Given Scale and Gravity Priors,Victor Fragoso,,,,,
719,Embodied Language Grounding With 3D Visual Feature Representations,Mihir Prabhudesai,,,,,
720,Learning to Autofocus,Charles Herrmann,,,,,
721,Joint Demosaicing and Denoising With Self Guidance,Lin Liu,,,,,
722,Learning to Restore Low-Light Images via Decomposition-and-Enhancement,Ke Xu,,,,,
723,Photometric Stereo via Discrete Hypothesis-and-Test Search,Kenji Enomoto,,,,,
724,Fixed-Point Back-Propagation Training,Xishan Zhang,,,,,
725,Heterogeneous Knowledge Distillation Using Information Flow Modeling,Nikolaos Passalis,,,,,
726,Residual Feature Aggregation Network for Image Super-Resolution,Jie Liu,,,,,
727,Resolution Adaptive Networks for Efficient Inference,Le Yang,,,,,
728,Learning to Forget for Meta-Learning,Sungyong Baik,,,,,
729,Deep Learning for Handling Kernel/model Uncertainty in Image Deconvolution,Yuesong Nan,,,,,
730,Reflection Scene Separation From a Single Image,Renjie Wan,,,,,
731,Wavelet Synthesis Net for Disparity Estimation to Synthesize DSLR Calibre Bokeh Effect on Smartphones,Chenchi Luo,,,,,
732,Bundle Adjustment on a Graph Processor,Joseph Ortiz,,,,,
733,3D-ZeF: A 3D Zebrafish Tracking Benchmark Dataset,Malte Pedersen,,,,,
734,Single-Shot Monocular RGB-D Imaging Using Uneven Double Refraction,Andreas Meuleman,,,,,
735,"Inverse Rendering for Complex Indoor Scenes: Shape, Spatially-Varying Lighting and SVBRDF From a Single Image",Zhengqin Li,,,,,
736,From Two Rolling Shutters to One Global Shutter,Cenek Albl,,,,,
737,Blur Aware Calibration of Multi-Focus Plenoptic Camera,Mathieu Labussiere,,,,,
738,Learning Fused Pixel and Feature-Based View Reconstructions for Light Fields,Jinglei Shi,,,,,
739,Instance Guided Proposal Network for Person Search,Wenkai Dong,,,,,
740,Which Is Plagiarism: Fashion Image Retrieval Based on Regional Representation for Design Protection,Yining Lang,,,,,
741,Inter-Task Association Critic for Cross-Resolution Person Re-Identification,Zhiyi Cheng,,,,,
742,FineGym: A Hierarchical Video Dataset for Fine-Grained Action Understanding,Dian Shao,,,,,
743,Mapillary Street-Level Sequences: A Dataset for Lifelong Place Recognition,Frederik Warburg,,,,,
744,BDD100K: A Diverse Driving Dataset for Heterogeneous Multitask Learning,Fisher Yu,,,,,
745,Rethinking Computer-Aided Tuberculosis Diagnosis,Yun Liu,,,,,
746,Revisiting Saliency Metrics: Farthest-Neighbor Area Under Curve,Sen Jia,,,,,
747,Improving Confidence Estimates for Unfamiliar Examples,Zhizhong Li,,,,,
748,Explorable Super Resolution,Yuval Bahat,,,,,
749,Deblurring by Realistic Blurring,Kaihao Zhang,,,,,
750,Bringing Old Photos Back to Life,Ziyu Wan,,,,,
751,Domain Adaptation for Image Dehazing,Yuanjie Shao,,,,,
752,Bi-Directional Interaction Network for Person Search,Wenkai Dong,,,,,
753,Space-Time-Aware Multi-Resolution Video Enhancement,Muhammad Haris,,,,,
754,Learning Multi-Granular Hypergraphs for Video-Based Person Re-Identification,Yichao Yan,,,,,
755,Online Joint Multi-Metric Adaptation From Frequent Sharing-Subset Mining for Person Re-Identification,Jiahuan Zhou,,,,,
756,Taking a Deeper Look at Co-Salient Object Detection,Deng-Ping Fan,,,,,
757,Deep Metric Learning via Adaptive Learnable Assessment,Wenzhao Zheng,,,,,
758,Deep Representation Learning on Long-Tailed Data: A Learnable Embedding Augmentation Perspective,Jialun Liu,,,,,
759,Fantastic Answers and Where to Find Them: Immersive Question-Directed Visual Attention,Ming Jiang,,,,,
760,HUMBI: A Large Multiview Dataset of Human Body Expressions,Zhixuan Yu,,,,,
761,Image Search With Text Feedback by Visiolinguistic Attention Learning,Yanbei Chen,,,,,
762,Image Processing Using Multi-Code GAN Prior,Jinjin Gu,,,,,
763,What Does Plate Glass Reveal About Camera Calibration?,Qian Zheng,,,,,
764,From Fidelity to Perceptual Quality: A Semi-Supervised Approach for Low-Light Image Enhancement,Wenhan Yang,,,,,
765,ARCH: Animatable Reconstruction of Clothed Humans,Zeng Huang,,,,,
766,Novel Object Viewpoint Estimation Through Reconstruction Alignment,Mohamed El Banani,,,,,
767,Creating Something From Nothing: Unsupervised Knowledge Distillation for Cross-Modal Hashing,Hengtong Hu,,,,,
768,Style Normalization and Restitution for Generalizable Person Re-Identification,Xin Jin,,,,,
769,"Reconstruct Locally, Localize Globally: A Model Free Method for Object Pose Estimation",Ming Cai,,,,,
770,RoboTHOR: An Open Simulation-to-Real Embodied AI Platform,Matt Deitke,,,,,
771,All in One Bad Weather Removal Using Architectural Search,Ruoteng Li,,,,,
772,HOnnotate: A Method for 3D Annotation of Hand and Object Poses,Shreyas Hampali,,,,,
773,On the Uncertainty of Self-Supervised Monocular Depth Estimation,Matteo Poggi,,,,,
774,Unsupervised Learning for Intrinsic Image Decomposition From a Single Image,Yunfei Liu,,,,,
775,Multi-Domain Learning for Accurate and Few-Shot Color Constancy,Jin Xiao,,,,,
776,PANDA: A Gigapixel-Level Human-Centric Video Dataset,Xueyang Wang,,,,,
777,Cross-View Tracking for Multi-Human 3D Pose Estimation at Over 100 FPS,Long Chen,,,,,
778,Spatial-Temporal Graph Convolutional Network for Video-Based Person Re-Identification,Jinrui Yang,,,,,
779,Salience-Guided Cascaded Suppression Network for Person Re-Identification,Xuesong Chen,,,,,
780,Fashion Outfit Complementary Item Retrieval,Yen-Liang Lin,,,,,
781,Learning Event-Based Motion Deblurring,Zhe Jiang,,,,,
782,Domain Decluttering: Simplifying Images to Mitigate Synthetic-Real Domain Shift and Improve Depth Estimation,Yunhan Zhao,,,,,
783,Anisotropic Convolutional Networks for 3D Semantic Scene Completion,Jie Li,,,,,
784,COCAS: A Large-Scale Clothes Changing Person Dataset for Re-Identification,Shijie Yu,,,,,
785,Learning Formation of Physically-Based Face Attributes,Ruilong Li,,,,,
786,Stereoscopic Flash and No-Flash Photography for Shape and Albedo Recovery,Xu Cao,,,,,
787,Context-Aware Group Captioning via Self-Attention and Contrastive Features,Zhuowan Li,,,,,
788,MEBOW: Monocular Estimation of Body Orientation in the Wild,Chenyan Wu,,,,,
789,Distilling Image Dehazing With Heterogeneous Task Imitation,Ming Hong,,,,,
790,"Select, Supplement and Focus for RGB-D Saliency Detection",Miao Zhang,,,,,
791,"On Joint Estimation of Pose, Geometry and svBRDF From a Handheld Scanner",Carolin Schmitt,,,,,
792,Differentiable Volumetric Rendering: Learning Implicit 3D Representations Without 3D Supervision,Michael Niemeyer,,,,,
793,Meta-Transfer Learning for Zero-Shot Super-Resolution,Jae Woong Soh,,,,,
794,Solving Jigsaw Puzzles With Eroded Boundaries,Dov Bridger,,,,,
795,Context-Aware Attention Network for Image-Text Retrieval,Qi Zhang,,,,,
796,M-LVC: Multiple Frames Prediction for Learned Video Compression,Jianping Lin,,,,,
797,Efficient Dynamic Scene Deblurring Using Spatially Variant Deconvolution Network With Optical Flow Guided Training,Yuan Yuan,,,,,
798,Video to Events: Recycling Video Datasets for Event Cameras,Daniel Gehrig,,,,,
799,Composed Query Image Retrieval Using Locally Bounded Features,Mehrdad Hosseinzadeh,,,,,
800,Spatially-Attentive Patch-Hierarchical Network for Adaptive Motion Deblurring,Maitreya Suin,,,,,
801,End-to-End Illuminant Estimation Based on Deep Metric Learning,Bolei Xu,,,,,
802,Variational-EM-Based Deep Learning for Noise-Blind Image Deblurring,Yuesong Nan,,,,,
803,Assessing Image Quality Issues for Real-World Problems,Tai-Yin Chiu,,,,,
804,Memory-Efficient Hierarchical Neural Architecture Search for Image Denoising,Haokui Zhang,,,,,
805,Blindly Assess Image Quality in the Wild Guided by a Self-Adaptive Hyper Network,Shaolin Su,,,,,
806,Don't Hit Me! Glass Detection in Real-World Scenes,Haiyang Mei,,,,,
807,Progressive Mirror Detection,Jiaying Lin,,,,,
808,Dynamic Graph Message Passing Networks,Li Zhang,,,,,
809,End-to-End Optimization of Scene Layout,Andrew Luo,,,,,
810,Unsupervised Intra-Domain Adaptation for Semantic Segmentation Through Self-Supervision,Fei Pan,,,,,
811,Self-Supervised Scene De-Occlusion,Xiaohang Zhan,,,,,
812,BANet: Bidirectional Aggregation Network With Occlusion Handling for Panoptic Segmentation,Yifeng Chen,,,,,
813,CPR-GCN: Conditional Partial-Residual Graph Convolutional Network in Automated Anatomical Labeling of Coronary Arteries,Han Yang,,,,,
814,Cross-View Correspondence Reasoning Based on Bipartite Graph Convolutional Network for Mammogram Mass Detection,Yuhang Liu,,,,,
815,MPM: Joint Representation of Motion and Position Map for Cell Tracking,Junya Hayashida,,,,,
816,Deep Distance Transform for Tubular Structure Segmentation in CT Scans,Yan Wang,,,,,
817,Multi-scale Domain-adversarial Multiple-instance CNN for Cancer Subtype Classification with Unannotated Histopathological Images,Noriaki Hashimoto,,,,,
818,METAL: Minimum Effort Temporal Activity Localization in Untrimmed Videos,Da Zhang,,,,,
819,Neural Data Server: A Large-Scale Search Engine for Transfer Learning Data,Xi Yan,,,,,
820,DEPARA: Deep Attribution Graph for Deep Knowledge Transferability,Jie Song,,,,,
821,Conditional Channel Gated Networks for Task-Aware Continual Learning,Davide Abati,,,,,
822,FocalMix: Semi-Supervised Learning for 3D Medical Image Detection,Dong Wang,,,,,
823,Learning 3D Semantic Scene Graphs From 3D Indoor Reconstructions,Johanna Wald,,,,,
824,Two-Shot Spatially-Varying BRDF and Shape Estimation,Mark Boss,,,,,
825,Variational Context-Deformable ConvNets for Indoor Scene Parsing,Zhitong Xiong,,,,,
826,What Can Be Transferred: Unsupervised Domain Adaptation for Endoscopic Lesions Segmentation,Jiahua Dong,,,,,
827,ADINet: Attribute Driven Incremental Network for Retinal Image Classification,Qier Meng,,,,,
828,Unsupervised Domain Adaptation With Hierarchical Gradient Synchronization,Lanqing Hu,,,,,
829,Deep Grouping Model for Unified Perceptual Parsing,Zhiheng Li,,,,,
830,Where Am I Looking At? Joint Location and Orientation Estimation by Cross-View Matching,Yujiao Shi,,,,,
831,Gum-Net: Unsupervised Geometric Matching for Fast and Accurate 3D Subtomogram Image Alignment and Averaging,Xiangrui Zeng,,,,,
832,FDA: Fourier Domain Adaptation for Semantic Segmentation,Yanchao Yang,,,,,
833,Foreground-Aware Relation Network for Geospatial Object Segmentation in High Spatial Resolution Remote Sensing Imagery,Zhuo Zheng,,,,,
834,When2com: Multi-Agent Perception via Communication Graph Grouping,Yen-Cheng Liu,,,,,
835,C2FNAS: Coarse-to-Fine Neural Architecture Search for 3D Medical Image Segmentation,Qihang Yu,,,,,
836,Learning to Detect Important People in Unlabelled Images for Semi-Supervised Important People Detection,Fa-Ting Hong,,,,,
837,Stochastic Sparse Subspace Clustering,Ying Chen,,,,,
838,CRNet: Cross-Reference Networks for Few-Shot Segmentation,Weide Liu,,,,,
839,Shoestring: Graph-Based Semi-Supervised Classification With Severely Limited Labeled Data,Wanyu Lin,,,,,
840,Uninformed Students: Student-Teacher Anomaly Detection With Discriminative Latent Embeddings,Paul Bergmann,,,,,
841,Composing Good Shots by Exploiting Mutual Relations,Debang Li,,,,,
842,Organ at Risk Segmentation for Head and Neck Cancer Using Stratified Learning and Neural Architecture Search,Dazhou Guo,,,,,
843,Unsupervised Instance Segmentation in Microscopy Images via Panoptic Domain Adaptation and Task Re-Weighting,Dongnan Liu,,,,,
844,DuDoRNet: Learning a Dual-Domain Recurrent Network for Fast MRI Reconstruction With Deep T1 Prior,Bo Zhou,,,,,
845,FOAL: Fast Online Adaptive Learning for Cardiac Motion Estimation,Hanchao Yu,,,,,
846,Cross-Domain Semantic Segmentation via Domain-Invariant Interactive Relation Transfer,Fengmao Lv,,,,,
847,Inflated Episodic Memory With Region Self-Attention for Long-Tailed Visual Recognition,Linchao Zhu,,,,,
848,Structure Preserving Generative Cross-Domain Learning,Haifeng Xia,,,,,
849,Reverse Perspective Network for Perspective-Aware Object Counting,Yifan Yang,,,,,
850,Multi-Path Region Mining for Weakly Supervised 3D Semantic Segmentation on Point Clouds,Jiacheng Wei,,,,,
851,Reliable Weighted Optimal Transport for Unsupervised Domain Adaptation,Renjun Xu,,,,,
852,ImVoteNet: Boosting 3D Object Detection in Point Clouds With Image Votes,Charles R. Qi,,,,,
853,Understanding Road Layout From Videos as a Whole,Buyu Liu,,,,,
854,Bi-Directional Relationship Inferring Network for Referring Image Segmentation,Zhiwei Hu,,,,,
855,Perspective Plane Program Induction From a Single Image,Yikai Li,,,,,
856,DeepFLASH: An Efficient Network for Learning-Based Medical Image Registration,Jian Wang,,,,,
857,Semantic Correspondence as an Optimal Transport Problem,Yanbin Liu,,,,,
858,How Much Time Do You Have? Modeling Multi-Duration Saliency,Camilo Fosco,,,,,
859,Fine-Grained Generalized Zero-Shot Learning via Dense Attribute-Based Attention,Dat Huynh,,,,,
860,Online Depth Learning Against Forgetting in Monocular Videos,Zhenyu Zhang,,,,,
861,Few-Shot Learning of Part-Specific Probability Space for 3D Shape Segmentation,Lingjing Wang,,,,,
862,Pattern-Structure Diffusion for Multi-Task Learning,Ling Zhou,,,,,
863,Training Noise-Robust Deep Neural Networks via Meta-Learning,Zhen Wang,,,,,
864,Universal Source-Free Domain Adaptation,Jogendra Nath Kundu,,,,,
865,Varicolored Image De-Hazing,Akshay Dudhane,,,,,
866,SpSequenceNet: Semantic Segmentation Network on 4D Point Clouds,Hanyu Shi,,,,,
867,Separating Particulate Matter From a Single Microscopic Image,Tushar Sandhan,,,,,
868,Adaptive Dilated Network With Self-Correction Supervision for Counting,Shuai Bai,,,,,
869,Learning to Select Base Classes for Few-Shot Classification,Linjun Zhou,,,,,
870,Distilled Semantics for Comprehensive Scene Understanding from Videos,Fabio Tosi,,,,,
871,Modeling Biological Immunity to Adversarial Examples,Edward Kim,,,,,
872,DOA-GAN: Dual-Order Attentive Generative Adversarial Network for Image Copy-Move Forgery Detection and Localization,Ashraful Islam,,,,,
873,Correspondence-Free Material Reconstruction using Sparse Surface Constraints,Sebastian Weiss,,,,,
874,Augmenting Colonoscopy Using Extended and Directional CycleGAN for Lossy Image Translation,Shawn Mathew,,,,,
875,Attention Scaling for Crowd Counting,Xiaoheng Jiang,,,,,
876,A Spatiotemporal Volumetric Interpolation Network for 4D Dynamic Medical Image,Yuyu Guo,,,,,
877,PatchVAE: Learning Local Latent Codes for Recognition,Kamal Gupta,,,,,
878,Self-Supervised Monocular Trained Depth Estimation Using Self-Attention and Discrete Disparity Volume,Adrian Johnston,,,,,
879,STAViS: Spatio-Temporal AudioVisual Saliency Network,Antigoni Tsiami,,,,,
880,DUNIT: Detection-Based Unsupervised Image-to-Image Translation,Deblina Bhattacharjee,,,,,
881,Learning to Observe: Approximating Human Perceptual Thresholds for Detection of Suprathreshold Image Transformations,Alan Dolhasz,,,,,
882,Structure Boundary Preserving Segmentation for Medical Image With Ambiguous Boundary,Hong Joo Lee,,,,,
883,Predicting Cognitive Declines Using Longitudinally Enriched Representations for Imaging Biomarkers,Lyujian Lu,,,,,
884,Predicting Lymph Node Metastasis Using Histopathological Images Based on Multiple Instance Learning With Deep Graph Convolution,Yu Zhao,,,,,
885,Local Deep Implicit Functions for 3D Shape,Kyle Genova,,,,,
886,RoutedFusion: Learning Real-Time Depth Map Fusion,Silvan Weder,,,,,
887,Learning to Optimize Non-Rigid Tracking,Yang Li,,,,,
888,Information-Driven Direct RGB-D Odometry,Alejandro Fontan,,,,,
889,ReDA:Reinforced Differentiable Attribute for 3D Face Reconstruction,Wenbin Zhu,,,,,
890,EventCap: Monocular 3D Capture of High-Speed Human Motions Using an Event Camera,Lan Xu,,,,,
891,Cross-Modal Deep Face Normals With Deactivable Skip Connections,Victoria Fernandez Abrevaya,,,,,
892,Weakly-Supervised Mesh-Convolutional Hand Reconstruction in the Wild,Dominik Kulon,,,,,
893,Cascade EF-GAN: Progressive Facial Expression Editing With Local Focuses,Rongliang Wu,,,,,
894,GanHand: Predicting Human Grasp Affordances in Multi-Object Scenes,Enric Corona,,,,,
895,DeepCap: Monocular Human Performance Capture Using Weak Supervision,Marc Habermann,,,,,
896,Advancing High Fidelity Identity Swapping for Forgery Detection,Lingzhi Li,,,,,
897,Controllable Person Image Synthesis With Attribute-Decomposed GAN,Yifang Men,,,,,
898,Blurry Video Frame Interpolation,Wang Shen,,,,,
899,Learning Physics-Guided Face Relighting Under Directional Light,Thomas Nestmeyer,,,,,
900,Single Image Reflection Removal With Physically-Based Training Images,Soomin Kim,,,,,
901,Image Based Virtual Try-On Network From Unpaired Data,Assaf Neuberger,,,,,
902,RetinaFace: Single-Shot Multi-Level Face Localisation in the Wild,Jiankang Deng,,,,,
903,A Stochastic Conditioning Scheme for Diverse Human Motion Prediction,Sadegh Aliakbarian,,,,,
904,Transferring Dense Pose to Proximal Animal Classes,Artsiom Sanakoyeu,,,,,
905,Weakly-Supervised 3D Human Pose Learning via Multi-View Images in the Wild,Umar Iqbal,,,,,
906,G3AN: Disentangling Appearance and Motion for Video Generation,Yaohui Wang,,,,,
907,Domain Adaptive Image-to-Image Translation,Ying-Cong Chen,,,,,
908,TransMoMo: Invariance-Driven Unsupervised Video Motion Retargeting,Zhuoqian Yang,,,,,
909,FReeNet: Multi-Identity Face Reenactment,Jiangning Zhang,,,,,
910,Novel View Synthesis of Dynamic Scenes With Globally Coherent Depths From a Monocular Camera,Jae Shin Yoon,,,,,
911,The GAN That Warped: Semantic Attribute Editing With Unpaired Data,Garoe Dorta,,,,,
912,4D Visualization of Dynamic Events From Unconstrained Multi-View Videos,Aayush Bansal,,,,,
913,Neural Voxel Renderer: Learning an Accurate and Controllable Rendering Tool,Konstantinos Rematas,,,,,
914,Probabilistic Structural Latent Representation for Unsupervised Embedding,Mang Ye,,,,,
915,Nested Scale-Editing for Conditional Image Synthesis,Lingzhi Zhang,,,,,
916,Fast Texture Synthesis via Pseudo Optimizer,Wu Shi,,,,,
917,CookGAN: Causality Based Text-to-Image Synthesis,Bin Zhu,,,,,
918,Future Video Synthesis With Object Motion Prediction,Yue Wu,,,,,
919,A Graduated Filter Method for Large Scale Robust Estimation,Huu Le,,,,,
920,A Multi-Task Mean Teacher for Semi-Supervised Shadow Detection,Zhihao Chen,,,,,
921,GroupFace: Learning Latent Groups and Constructing Group-Based Representations for Face Recognition,Yonghyun Kim,,,,,
922,Channel Attention Based Iterative Residual Learning for Depth Map Super-Resolution,Xibin Song,,,,,
923,Time Flies: Animating a Still Image With Time-Lapse Video As Reference,Chia-Chi Cheng,,,,,
924,SER-FIQ: Unsupervised Estimation of Face Image Quality Based on Stochastic Embedding Robustness,Philipp Terhorst,,,,,
925,Grid-GCN for Fast and Scalable Point Cloud Learning,Qiangeng Xu,,,,,
926,Domain Balancing: Face Recognition on Long-Tailed Domains,Dong Cao,,,,,
927,Data Uncertainty Learning in Face Recognition,Jie Chang,,,,,
928,Regularizing Discriminative Capability of CGANs for Semi-Supervised Generative Learning,Yi Liu,,,,,
929,FM2u-Net: Face Morphological Multi-Branch Network for Makeup-Invariant Face Verification,Wenxuan Wang,,,,,
930,UCTGAN: Diverse Image Inpainting Based on Unsupervised Cross-Space Translation,Lei Zhao,,,,,
931,Decoupled Representation Learning for Skeleton-Based Gesture Recognition,Jianbo Liu,,,,,
932,On the Detection of Digital Face Manipulation,Hao Dang,,,,,
933,Learning Texture Transformer Network for Image Super-Resolution,Fuzhi Yang,,,,,
934,Reference-Based Sketch Image Colorization Using Augmented-Self Reference and Dense Semantic Correspondence,Junsoo Lee,,,,,
935,Deblurring Using Analysis-Synthesis Networks Pair,Adam Kaufman,,,,,
936,Exploring Unlabeled Faces for Novel Attribute Discovery,Hyojin Bahng,,,,,
937,Fine-Grained Image-to-Image Transformation Towards Visual Recognition,Wei Xiong,,,,,
938,Deep Facial Non-Rigid Multi-View Stereo,Ziqian Bai,,,,,
939,Attention-Driven Cropping for Very High Resolution Facial Landmark Detection,Prashanth Chandran,,,,,
940,Towards Unsupervised Learning of Generative Models for 3D Controllable Image Synthesis,Yiyi Liao,,,,,
941,End-to-End Pseudo-LiDAR for Image-Based 3D Object Detection,Rui Qian,,,,,
942,Rotate-and-Render: Unsupervised Photorealistic Face Rotation From Single-View Images,Hang Zhou,,,,,
943,One-Shot Domain Adaptation for Face Generation,Chao Yang,,,,,
944,BidNet: Binocular Image Dehazing Without Explicit Disparity Estimation,Yanwei Pang,,,,,
945,Joint Texture and Geometry Optimization for RGB-D Reconstruction,Yanping Fu,,,,,
946,Deep 3D Capture: Geometry and Reflectance From Sparse Multi-View Images,Sai Bi,,,,,
947,Auto-Tuning Structured Light by Optical Stochastic Gradient Descent,Wenzheng Chen,,,,,
948,MARMVS: Matching Ambiguity Reduced Multiple View Stereo for Efficient Large Scale Scene Reconstruction,Zhenyu Xu,,,,,
949,Local Implicit Grid Representations for 3D Scenes,"Chiyu ""Max"" Jiang",,,,,
950,TetraTSDF: 3D Human Reconstruction From a Single Image With a Tetrahedral Outer Shell,Hayato Onizuka,,,,,
951,Averaging Essential and Fundamental Matrices in Collinear Camera Settings,Amnon Geifman,,,,,
952,On the Distribution of Minima in Intrinsic-Metric Rotation Averaging,Kyle Wilson,,,,,
953,Lightweight Multi-View 3D Pose Estimation Through Camera-Disentangled Representation,Edoardo Remelli,,,,,
954,Factorized Higher-Order CNNs With an Application to Spatio-Temporal Emotion Estimation,Jean Kossaifi,,,,,
955,Robust Homography Estimation via Dual Principal Component Pursuit,Tianjiao Ding,,,,,
956,Uncertainty-Aware Mesh Decoder for High Fidelity 3D Face Reconstruction,Gun-Hee Lee,,,,,
957,3FabRec: Fast Few-Shot Face Alignment by Reconstruction,Bjorn Browatzki,,,,,
